"TITLE: Knowledge precepts for design and evaluation of information visualizations WORDS: rendering, surface, algorithm, user, time, volume, analysis, visual, features, new, techniques, use, allows, information, interactive, propose, performance, video, methods, set",Knowledge precepts for design and evaluation of information visualizations,0,0.395058720076,0,0,0,0,0,0.217622030034,0,0,0,0,0,0,0,0,0,0,0.373609572211,0,343
"TITLE: An insight-based methodology for evaluating bioinformatics visualizations WORDS: analysis, visual, video, methods, different, user, model, interactive, models, algorithm, time, techniques, use, novel, display, design, demonstrate, visualizations, surface, rendering",An insight-based methodology for evaluating bioinformatics visualizations,0,0,0,0,0.444949445819,0,0,0.54526794529,0,0,0,0,0,0,0,0,0,0,0,0,344
"TITLE: Topological fisheye views for visualizing large graphs WORDS: algorithm, information, virtual, graph, surface, used, user, rendering, field, points, analysis, visual, new, color, level, propose, use, large, image, proposed",Topological fisheye views for visualizing large graphs,0,0,0,0.980612244567,0,0,0,0,0,0,0,0,0,0,0,0,0,0,0,0,345
"TITLE: Clifford Fourier transform on vector fields WORDS: methods, analysis, surfaces, surface, techniques, framework, new, proposed, flow, used, algorithm, applications, rendering, algorithms, space, local, efficient, visual, technique, user",Clifford Fourier transform on vector fields,0,0,0,0,0,0,0,0,0.991880341741,0,0,0,0,0,0,0,0,0,0,0,346
"TITLE: Reconstruction and visualization of planetary nebulae WORDS: surface, model, shape, rendering, techniques, new, surfaces, structure, algorithms, time, modeling, use, user, algorithm, space, used, visual, methods, dynamic, models",Reconstruction and visualization of planetary nebulae,0,0,0.107185110303,0,0,0,0,0,0,0,0,0,0,0.883903998417,0,0,0,0,0,0,347
"TITLE: Advanced virtual endoscopic pituitary surgery WORDS: rendering, volume, model, algorithm, interactive, methods, used, techniques, image, simulation, noise, quality, field, software, scene, new, surface, problem, visual, provides",Advanced virtual endoscopic pituitary surgery,0,0,0,0,0,0,0,0,0,0,0,0,0,0,0,0,0.989080459635,0,0,0,348
"TITLE: Visualization of geologic stress perturbations using Mohr diagrams WORDS: vector, image, space, algorithms, field, algorithm, performance, users, problem, virtual, volume, new, user, different, interaction, motion, analysis, used, methods, use",Visualization of geologic stress perturbations using Mohr diagrams,0,0,0,0,0,0,0,0,0,0.989560439377,0,0,0,0,0,0,0,0,0,0,349
"TITLE: Decorating surfaces with bidirectional texture functions WORDS: methods, analysis, surfaces, surface, techniques, framework, new, proposed, flow, used, algorithm, applications, rendering, algorithms, space, local, efficient, visual, technique, user",Decorating surfaces with bidirectional texture functions,0,0,0,0,0,0,0,0,0.989673912866,0,0,0,0,0,0,0,0,0,0,0,350
"TITLE: Boolean operations with implicit and parametric representation of primitives using R-functions WORDS: rendering, used, techniques, field, objects, new, model, surface, shape, large, technique, object, information, virtual, methods, surfaces, time, texture, user, light",Boolean operations with implicit and parametric representation of primitives using R-functions,0,0,0,0,0,0,0,0,0,0,0,0,0,0.381100976875,0,0,0,0.611335997775,0,0,351
"TITLE: Stroke surfaces: temporally coherent artistic animations from video WORDS: mesh, surface, algorithm, images, algorithms, space, set, geometry, sets, meshes, points, volume, large, analysis, visual, video, methods, different, user, model",Stroke surfaces: temporally coherent artistic animations from video,0,0,0,0,0,0.940717347133,0,0.0471204904756,0,0,0,0,0,0,0,0,0,0,0,0,352
"TITLE: Radiance caching for efficient global illumination computation WORDS: graph, used, virtual, visual, color, field, points, analysis, level, proposed, image, rendering, surface, algorithm, user, time, volume, features, techniques, new",Radiance caching for efficient global illumination computation,0,0,0,0.885851058825,0,0,0,0,0,0,0,0,0,0,0,0,0,0,0.0977853044676,0,353
"TITLE: Faster isosurface ray tracing using implicit KD-trees WORDS: information, rendering, analysis, visual, used, use, model, interactive, different, volume, algorithm, new, design, study, features, set, models, technique, techniques, user",Faster isosurface ray tracing using implicit KD-trees,0,0.990104166488,0,0,0,0,0,0,0,0,0,0,0,0,0,0,0,0,0,0,354
"TITLE: A sampling framework for accurate curvature estimation in discrete surfaces WORDS: methods, analysis, surfaces, surface, techniques, framework, new, proposed, flow, used, algorithm, applications, rendering, algorithms, space, local, efficient, visual, technique, user",A sampling framework for accurate curvature estimation in discrete surfaces,0,0,0,0,0,0,0,0,0.991203703549,0,0,0,0,0,0,0,0,0,0,0,355
"TITLE: Interactive transparency rendering for large CAD models WORDS: algorithm, model, used, methods, image, rendering, visual, function, surface, sets, shape, techniques, novel, proposed, different, domain, efficient, images, set, complex",Interactive transparency rendering for large CAD models,0,0,0,0,0,0,0,0,0,0,0,0,0,0,0,0,0,0,0,0.992399999749,356
"TITLE: Blind robust watermarking schemes for copyright protection of 3D mesh objects WORDS: surfaces, interactive, models, visualizations, demonstrate, mesh, user, optimization, technique, control, graphics, problem, texture, vector, time, representation, mapping, applications, new, hardware",Blind robust watermarking schemes for copyright protection of 3D mesh objects,0,0,0,0,0.488523799463,0,0,0,0,0.129206645737,0,0,0.305613480705,0,0,0,0,0,0,0.06849280862,357
"TITLE:  WORDS: rendering, volume, algorithm, technique, techniques, analysis, virtual, methods, used, new, surface, visual, user, interactive, proposed, point, display, use, order, sets",,0,0,0,0,0,0,0,0,0,0,0,0,0,0,0,0.89444444308,0,0,0,0,358
"TITLE: TORNADO: omnistereo video imaging with rotating optics WORDS: mesh, surface, video, algorithm, images, new, rendering, algorithms, time, space, points, geometry, volume, sets, techniques, set, meshes, large, novel, used",TORNADO: omnistereo video imaging with rotating optics,0,0,0,0,0,0.987162161983,0,0,0,0,0,0,0,0,0,0,0,0,0,0,359
"TITLE: Development of anthropomorphic multi-D.O.F master-slave arm for mutual telexistence WORDS: rendering, volume, algorithm, technique, techniques, analysis, virtual, methods, used, new, surface, visual, user, interactive, proposed, point, display, use, order, sets",Development of anthropomorphic multi-D.O.F master-slave arm for mutual telexistence,0,0,0,0,0,0,0,0,0,0,0,0,0,0,0,0.98515624978,0,0,0,0,360
"TITLE: Data streaming in telepresence environments WORDS: analysis, visual, methods, video, model, different, user, time, design, novel, use, display, techniques, new, virtual, rendering, used, image, applications, study",Data streaming in telepresence environments,0,0,0,0,0,0,0,0.98944444426,0,0,0,0,0,0,0,0,0,0,0,0,361
"TITLE: Dynamic interactions in physically realistic collaborative virtual environments WORDS: volume, simulation, interactive, vector, problem, surface, visual, software, quality, scene, noise, provides, different, models, framework, motion, sets, use, environment, design",Dynamic interactions in physically realistic collaborative virtual environments,0,0,0,0,0,0,0,0,0,0.159294054632,0.30120400592,0,0,0,0,0,0.423557183681,0.107944755601,0,0,362
"TITLE: Six degree-of-freedom haptic rendering using spatialized normal cone search WORDS: surfaces, proposed, applications, algorithms, space, efficient, local, new, algorithm, rendering, techniques, user, flow, technique, novel, used, surface, visual, image, virtual",Six degree-of-freedom haptic rendering using spatialized normal cone search,0,0,0,0,0,0,0,0,0.503760561811,0,0.230333362439,0.25016533467,0,0,0,0,0,0,0,0,363
"TITLE: Cutting on triangle mesh: local model-based haptic display for dental preparation surgery simulation WORDS: analysis, visual, methods, video, model, different, user, time, design, novel, use, display, techniques, new, virtual, rendering, used, image, applications, study",Cutting on triangle mesh: local model-based haptic display for dental preparation surgery simulation,0,0,0,0,0,0,0,0.989204545284,0,0,0,0,0,0,0,0,0,0,0,0,364
"TITLE: Psychophysical evaluation of in-situ ultrasound visualization WORDS: analysis, visual, new, interactive, features, set, technique, study, user, model, rendering, techniques, information, virtual, objects, surface, different, object, models, motion",Psychophysical evaluation of in-situ ultrasound visualization,0,0.885990196285,0,0,0,0,0,0,0,0,0.105438374997,0,0,0,0,0,0,0,0,0,365
"TITLE: Comparison of path visualizations and cognitive measures relative to travel technique in a virtual environment WORDS: model, user, rendering, information, virtual, techniques, objects, models, motion, volume, surface, different, framework, object, design, used, algorithm, sets, use, environment",Comparison of path visualizations and cognitive measures relative to travel technique in a virtual environment,0,0,0,0,0,0,0,0,0,0,0.98999999981,0,0,0,0,0,0,0,0,0,366
"TITLE: Real-time 3D human capture system for mixed-reality art and entertainment WORDS: rendering, volume, model, algorithm, interactive, methods, used, techniques, image, simulation, noise, quality, field, software, scene, new, surface, problem, visual, provides",Real-time 3D human capture system for mixed-reality art and entertainment,0,0,0,0,0,0,0,0,0,0,0,0,0,0,0,0,0.988953488143,0,0,0,367
"TITLE: An infrastructure for realizing custom-tailored augmented reality user interfaces WORDS: new, algorithm, rendering, techniques, user, flow, used, set, visual, surface, technique, image, virtual, novel, objects, different, object, models, volume, framework",An infrastructure for realizing custom-tailored augmented reality user interfaces,0,0,0,0,0,0,0,0,0,0,0.426129174842,0.56302745143,0,0,0,0,0,0,0,0,368
"TITLE: Achieving dialogue with children with severe autism in an adaptive multisensory interaction: the    34;MEDIATE   34; project WORDS: model, user, rendering, information, virtual, techniques, objects, models, motion, volume, surface, different, framework, object, design, used, algorithm, sets, use, environment",Achieving dialogue with children with severe autism in an adaptive multisensory interaction: the    34;MEDIATE   34; project,0,0,0,0,0,0,0,0,0,0,0.983620689454,0,0,0,0,0,0,0,0,0,369
"TITLE: A particle system for interactive visualization of 3D flows WORDS: objects, different, object, models, volume, framework, sets, environment, use, design, new, algorithm, rendering, techniques, user, flow, used, set, visual, surface",A particle system for interactive visualization of 3D flows,0,0,0,0,0,0,0,0,0,0,0.880301062159,0.111734335896,0,0,0,0,0,0,0,0,370
"TITLE: Non-Eeuclidean spring embedders WORDS: surface, visual, surfaces, mesh, different, user, rendering, problem, graphics, texture, algorithm, methods, new, hardware, novel, time, mapping, image, applications, representation",Non-Eeuclidean spring embedders,0,0,0,0,0,0,0,0,0.0992409871574,0,0,0,0.883111953689,0,0,0,0,0,0,0,371
"TITLE:  WORDS: vector, space, algorithms, performance, users, different, user, virtual, interaction, analysis, use, motion, rendering, volume, model, algorithm, used, techniques, simulation, interactive",,0,0,0,0,0,0,0,0,0,0.772836920569,0,0,0,0,0,0,0.218163079277,0,0,0,372
"TITLE: Time-varying contour topology WORDS: information, rendering, analysis, visual, used, use, model, interactive, different, volume, algorithm, new, design, study, features, set, models, technique, techniques, user",Time-varying contour topology,0,0.988554216641,0,0,0,0,0,0,0,0,0,0,0,0,0,0,0,0,0,0,373
"TITLE: Distance preserving flattening of surface sections WORDS: surface, visual, surfaces, mesh, different, user, rendering, problem, algorithm, methods, graphics, texture, novel, time, new, mapping, representation, hardware, image, applications",Distance preserving flattening of surface sections,0,0,0,0,0,0,0,0,0,0,0,0,0.989784946096,0,0,0,0,0,0,0,374
"TITLE: Realistic haptic rendering of interacting deformable objects in virtual environments WORDS: algorithm, time, set, technique, rendering, model, interactive, motion, techniques, mesh, volume, models, used, new, surface, sets, use, demonstrate, large, novel",Realistic haptic rendering of interacting deformable objects in virtual environments,0,0,0.991441441265,0,0,0,0,0,0,0,0,0,0,0,0,0,0,0,0,0,375
"TITLE: Geometry-driven photorealistic facial expression synthesis WORDS: rendering, used, techniques, field, objects, new, model, fields, flow, large, technique, methods, object, information, virtual, analysis, interactive, design, surfaces, time",Geometry-driven photorealistic facial expression synthesis,0.405979877934,0,0,0,0,0,0,0,0,0,0,0,0,0,0,0,0,0.582627716772,0,0,376
"TITLE: Stylized and abstract painterly rendering system using a multiscale segmented sphere hierarchy WORDS: information, rendering, analysis, visual, used, use, model, interactive, different, volume, algorithm, new, design, study, features, set, models, technique, techniques, user",Stylized and abstract painterly rendering system using a multiscale segmented sphere hierarchy,0,0.990404039975,0,0,0,0,0,0,0,0,0,0,0,0,0,0,0,0,0,0,377
"TITLE: A new combinatorial approach to surface reconstruction with sharp features WORDS: field, objects, new, large, technique, object, information, virtual, time, texture, user, light, display, algorithm, used, model, methods, image, rendering, visual",A new combinatorial approach to surface reconstruction with sharp features,0,0,0,0,0,0,0,0,0,0,0,0,0,0,0,0,0,0.811147727664,0,0.179174852772,378
"TITLE: Mesh parameterization by minimizing the synthesized distortion metric with the coefficient-optimizing algorithm WORDS: new, flow, user, technique, virtual, analysis, information, motion, real, algorithm, used, model, methods, image, rendering, function, surface, visual, shape, sets",Mesh parameterization by minimizing the synthesized distortion metric with the coefficient-optimizing algorithm,0,0,0,0,0,0,0,0,0,0,0,0.981325958351,0,0,0,0,0,0,0,0.010183475463,379
"TITLE: Thin structure segmentation and visualization in three-dimensional biomedical images: a shape-based approach WORDS: algorithm, field, visual, study, virtual, flow, use, new, surface, used, technique, different, techniques, texture, design, graph, time, large, methods, image",Thin structure segmentation and visualization in three-dimensional biomedical images: a shape-based approach,0,0,0,0,0,0,0,0,0,0,0,0,0,0,0.990104166498,0,0,0,0,0,380
"TITLE: Predictive haptic guidance: intelligent user assistance for the control of dynamic tasks WORDS: vector, new, algorithm, rendering, techniques, user, flow, field, algorithms, space, performance, visual, set, surface, used, technique, virtual, novel, image, users",Predictive haptic guidance: intelligent user assistance for the control of dynamic tasks,0,0.0819485974884,0,0,0,0,0,0,0,0.431562523319,0,0.477148219631,0,0,0,0,0,0,0,0,381
"TITLE: Ray-tracing polymorphic multidomain spectral/hp elements for isosurface rendering WORDS: algorithm, used, model, methods, image, rendering, function, surface, sets, visual, shape, efficient, images, set, different, proposed, domain, novel, complex, techniques",Ray-tracing polymorphic multidomain spectral/hp elements for isosurface rendering,0,0,0,0,0,0.249331513306,0,0,0,0,0,0,0,0,0,0,0,0,0,0.735668486401,382
"TITLE: Real-time animation of complex hairstyles WORDS: technique, shape, rendering, user, analysis, virtual, volume, surfaces, sets, proposed, use, display, point, order, algorithm, model, structure, time, algorithms, modeling",Real-time animation of complex hairstyles,0,0,0,0,0,0,0,0,0,0,0.142347499505,0,0,0.247976136753,0,0.385720254478,0.214653783495,0,0,0,383
"TITLE: Fast and reliable collision culling using graphics hardware WORDS: algorithm, time, set, technique, rendering, model, interactive, motion, techniques, mesh, volume, models, used, new, surface, sets, use, demonstrate, large, novel",Fast and reliable collision culling using graphics hardware,0,0,0.986619718125,0,0,0,0,0,0,0,0,0,0,0,0,0,0,0,0,0,384
"TITLE: Scanning scene tunnel for city traversing WORDS: algorithm, model, used, methods, image, rendering, visual, function, surface, sets, shape, techniques, novel, proposed, different, domain, efficient, images, set, complex",Scanning scene tunnel for city traversing,0,0,0,0,0,0,0,0,0,0,0,0,0,0,0,0,0,0,0,0.992213114586,385
"TITLE: Electrostatic tactile display with thin film slider and its application to tactile telepresentation systems WORDS: rendering, volume, algorithm, technique, techniques, analysis, virtual, methods, used, new, surface, visual, user, interactive, proposed, point, display, use, order, sets",Electrostatic tactile display with thin film slider and its application to tactile telepresentation systems,0,0,0,0,0,0,0,0,0,0,0,0,0,0,0,0.991517857012,0,0,0,0,386
"TITLE: Transpost: a novel approach to the display and transmission of 360 degrees-viewable 3D solid images WORDS: surface, rendering, used, field, techniques, objects, new, model, visual, surfaces, large, technique, object, information, virtual, methods, mesh, time, user, texture",Transpost: a novel approach to the display and transmission of 360 degrees-viewable 3D solid images,0,0,0,0,0,0,0,0,0,0,0,0,0.330533348091,0,0,0,0,0.658355540629,0,0,387
"TITLE: Interactive display of isosurfaces with global illumination WORDS: model, new, used, user, interactive, models, algorithm, methods, rendering, demonstrate, surface, visualizations, mesh, visual, optimization, technique, techniques, use, novel, control",Interactive display of isosurfaces with global illumination,0,0.213963520572,0,0,0.769672842695,0,0,0,0,0,0,0,0,0,0,0,0,0,0,0,388
"TITLE: Geometry-dependent lighting WORDS: model, user, rendering, techniques, information, virtual, objects, volume, motion, surface, different, object, framework, models, used, environment, use, algorithm, design, sets",Geometry-dependent lighting,0,0,0,0,0,0,0,0.232598145924,0,0,0.751330425211,0,0,0,0,0,0,0,0,0,389
"TITLE: Visualization of boundaries in volumetric data sets using LH histograms WORDS: rendering, surface, algorithm, user, time, volume, allows, features, interactive, propose, use, new, performance, techniques, information, large, objects, technique, different, framework",Visualization of boundaries in volumetric data sets using LH histograms,0,0,0,0,0,0,0,0,0,0,0,0,0,0,0,0,0,0,0.979347825682,0,390
"TITLE: Improving contact realism through event-based haptic feedback WORDS: algorithm, new, rendering, flow, techniques, user, virtual, novel, used, set, surface, visual, technique, image, motion, analysis, information, real, model, methods",Improving contact realism through event-based haptic feedback,0,0,0,0,0,0,0,0,0,0,0,0.991592920083,0,0,0,0,0,0,0,0,391
"TITLE: Discrete Sibson interpolation WORDS: model, simulation, methods, used, image, visual, field, noise, problem, software, quality, scene, provides, study, virtual, texture, flow, rendering, graph, design",Discrete Sibson interpolation,0,0,0,0,0,0,0,0,0,0,0,0,0.0573327999687,0,0.249136568879,0,0.600453168134,0,0.0816488913473,0,392
"TITLE: Noise-resistant fitting for spherical harmonics WORDS: user, virtual, users, new, analysis, volume, time, mesh, information, interactive, algorithm, structure, large, models, error, used, model, methods, image, rendering",Noise-resistant fitting for spherical harmonics,0,0,0,0,0,0,0.679521070242,0,0,0,0,0,0,0,0,0,0,0,0,0.31025165684,393
"TITLE: Accurate visible speech synthesis based on concatenating variable length motion capture data WORDS: shape, surfaces, structure, algorithms, time, modeling, user, use, space, dynamic, models, rendering, volume, model, algorithm, used, techniques, simulation, interactive, methods",Accurate visible speech synthesis based on concatenating variable length motion capture data,0,0,0,0,0,0,0,0,0,0,0,0,0,0.82678476296,0,0,0.165179522567,0,0,0,394
"TITLE: Optical merger of direct vision with virtual images for scaled teleoperation WORDS: interactive, models, rendering, used, techniques, field, demonstrate, visualizations, surface, objects, new, model, mesh, optimization, visual, control, use, novel, large, technique",Optical merger of direct vision with virtual images for scaled teleoperation,0,0,0,0,0.58449162082,0,0,0,0,0,0,0,0,0,0,0,0,0.406597487939,0,0,395
"TITLE: Segmentation of discrete vector fields WORDS: vector, image, space, algorithms, field, algorithm, performance, users, problem, virtual, volume, new, user, different, interaction, motion, analysis, used, methods, use",Segmentation of discrete vector fields,0,0,0,0,0,0,0,0,0,0.985606060321,0,0,0,0,0,0,0,0,0,0,396
"TITLE: Interpolation over arbitrary topology meshes using a two-phase subdivision scheme WORDS: surface, visual, surfaces, mesh, different, user, rendering, problem, algorithm, methods, graphics, texture, novel, time, new, mapping, representation, hardware, image, applications",Interpolation over arbitrary topology meshes using a two-phase subdivision scheme,0,0,0,0,0,0,0,0,0,0,0,0,0.986986301024,0,0,0,0,0,0,0,397
"TITLE: Knowledge discovery in high-dimensional data: case studies and a user survey for the rank-by-feature framework WORDS: user, virtual, users, analysis, visual, volume, algorithm, new, techniques, model, information, interactive, time, mesh, used, models, structure, surface, error, large",Knowledge discovery in high-dimensional data: case studies and a user survey for the rank-by-feature framework,0,0,0,0,0,0,0.989893616843,0,0,0,0,0,0,0,0,0,0,0,0,0,398
"TITLE: CAVE and fishtank virtual-reality displays: a qualitative and quantitative comparison WORDS: vector, image, space, algorithms, field, algorithm, performance, users, problem, virtual, volume, new, user, different, interaction, motion, analysis, used, methods, use",CAVE and fishtank virtual-reality displays: a qualitative and quantitative comparison,0,0,0,0,0,0,0,0,0,0.988271604759,0,0,0,0,0,0,0,0,0,0,399
"TITLE: Ribbon networks for modeling navigable paths of autonomous agents in virtual environments WORDS: model, shape, surface, rendering, new, techniques, surfaces, algorithms, time, modeling, use, algorithm, user, structure, space, models, methods, used, dynamic, visual",Ribbon networks for modeling navigable paths of autonomous agents in virtual environments,0,0,0,0,0,0,0,0,0,0,0,0,0,0.987499999803,0,0,0,0,0,0,400
"TITLE: Melting and burning solids into liquids and gases WORDS: set, rendering, used, interactive, motion, techniques, field, demonstrate, mesh, surface, sets, use, models, volume, objects, new, model, novel, technique, methods",Melting and burning solids into liquids and gases,0,0,0.567795582482,0,0,0,0,0,0,0,0,0,0,0,0,0,0,0.422314307478,0,0,401
"TITLE: Accurate direct illumination using iterative adaptive sampling WORDS: algorithm, new, rendering, flow, techniques, user, virtual, novel, used, set, surface, visual, technique, image, motion, analysis, information, real, model, methods",Accurate direct illumination using iterative adaptive sampling,0,0,0,0,0,0,0,0,0,0,0,0.987974683305,0,0,0,0,0,0,0,0,402
"TITLE: Dynamic simulation of articulated rigid bodies with contact and collision WORDS: user, virtual, users, analysis, visual, volume, algorithm, new, techniques, model, information, interactive, time, mesh, used, models, structure, surface, error, large",Dynamic simulation of articulated rigid bodies with contact and collision,0,0,0,0,0,0,0.991121495174,0,0,0,0,0,0,0,0,0,0,0,0,0,403
"TITLE: Meshless thin-shell simulation based on global conformal parameterization WORDS: algorithm, model, used, methods, image, rendering, visual, function, surface, sets, shape, techniques, novel, proposed, different, domain, efficient, images, set, complex",Meshless thin-shell simulation based on global conformal parameterization,0,0,0,0,0,0,0,0,0,0,0,0,0,0,0,0,0,0,0,0.99128440351,404
"TITLE: Dual Laplacian editing for meshes WORDS: virtual, users, techniques, analysis, volume, used, model, information, interactive, surface, structure, large, models, error, visual, surfaces, mesh, different, user, rendering",Dual Laplacian editing for meshes,0,0,0,0,0,0,0.804670101235,0,0,0,0,0,0.186238989519,0,0,0,0,0,0,0,405
"TITLE: The effect of visual and interaction fidelity on spatial cognition in immersive virtual environments WORDS: vector, image, space, algorithms, field, algorithm, performance, users, problem, virtual, volume, new, user, different, interaction, motion, analysis, used, methods, use",The effect of visual and interaction fidelity on spatial cognition in immersive virtual environments,0,0,0,0,0,0,0,0,0,0.99246031732,0,0,0,0,0,0,0,0,0,0,406
"TITLE: A network architecture supporting consistent rich behavior in collaborative interactive applications WORDS: rendering, volume, technique, techniques, algorithm, video, visual, new, surface, used, analysis, virtual, methods, user, time, novel, point, display, interactive, order",A network architecture supporting consistent rich behavior in collaborative interactive applications,0,0,0,0,0,0,0,0.390802769646,0,0,0.14410814245,0,0,0,0,0.452210299734,0,0,0,0,407
"TITLE: Views on Visualization WORDS: surfaces, surface, framework, proposed, flow, applications, visual, efficient, local, rendering, used, techniques, field, vector, objects, new, model, technique, object, information",Views on Visualization,0,0,0,0,0,0,0,0,0.749968981014,0.092366957827,0,0,0,0,0,0,0,0.145345220313,0,0,408
