"TITLE: An Overview of 3D Software Visualization WORDS: analysis, rendering, volume, video, different, user, model, algorithm, time, display, use, novel, design, used, techniques, simulation, interactive, methods, image, study",An Overview of 3D Software Visualization,0,0,0,0,0,0,0,0.527869797283,0,0,0,0,0,0,0,0,0.459454146152,0,0,0,680
"TITLE: Asymmetric Tensor Analysis for Flow Visualization WORDS: rendering, used, field, techniques, model, objects, new, information, virtual, methods, technique, large, object, time, texture, light, user, image, algorithm, display",Asymmetric Tensor Analysis for Flow Visualization,0,0,0,0,0,0,0,0,0,0,0,0,0,0,0,0,0,0.990594059242,0,0,681
"TITLE: Multiscale Time Activity Data Exploration via Temporal Clustering Visualization Spreadsheet WORDS: analysis, visual, methods, video, model, different, user, time, design, novel, use, display, techniques, new, virtual, rendering, used, image, applications, study",Multiscale Time Activity Data Exploration via Temporal Clustering Visualization Spreadsheet,0,0,0,0,0,0,0,0.986428571189,0,0,0,0,0,0,0,0,0,0,0,0,682
"TITLE:  WORDS: algorithm, used, model, methods, image, rendering, function, surface, visual, shape, sets, domain, images, set, different, techniques, complex, novel, proposed, efficient",,0,0,0,0,0,0,0,0,0,0,0,0,0,0.0186075833803,0,0,0,0.220653139903,0,0.747860488553,683
"TITLE: Edge Transformations for Improving Mesh Quality of Marching Cubes WORDS: surface, visual, surfaces, mesh, different, user, rendering, methods, graphics, texture, problem, algorithm, time, new, hardware, representation, mapping, novel, image, applications",Edge Transformations for Improving Mesh Quality of Marching Cubes,0,0,0,0,0,0,0.193914954454,0,0,0,0,0.0150825674624,0.78195992473,0,0,0,0,0,0,0,684
"TITLE: Random Accessible Mesh Compression Using Mesh Chartification WORDS: mesh, video, images, algorithms, time, space, geometry, sets, meshes, points, volume, large, new, algorithm, rendering, user, flow, techniques, used, set",Random Accessible Mesh Compression Using Mesh Chartification,0,0,0,0,0,0.848618598918,0,0,0,0,0,0.139381400861,0,0,0,0,0,0,0,0,685
"TITLE: An Evaluation of Graphical Context as a Means for Ameliorating the Effects of Registration Error WORDS: mesh, surface, video, algorithm, images, new, rendering, algorithms, time, space, points, geometry, volume, sets, techniques, set, meshes, large, novel, used",An Evaluation of Graphical Context as a Means for Ameliorating the Effects of Registration Error,0,0,0,0,0,0.987162161934,0,0,0,0,0,0,0,0,0,0,0,0,0,0,686
"TITLE: Comprehensible Visualization for Augmented Reality WORDS: rendering, used, field, techniques, objects, new, model, large, information, virtual, methods, technique, object, time, user, light, algorithm, display, texture, image",Comprehensible Visualization for Augmented Reality,0,0.0396275692469,0,0,0,0,0,0.102495950064,0.217182410883,0,0.0435152448543,0,0,0,0,0,0,0.588593622017,0,0,687
"TITLE: Survey of the Visual Exploration and Analysis of Perfusion Data WORDS: rendering, used, field, techniques, model, objects, new, information, virtual, methods, technique, large, object, time, texture, light, user, image, algorithm, display",Survey of the Visual Exploration and Analysis of Perfusion Data,0,0,0,0,0,0,0,0,0,0,0,0,0,0,0,0,0,0.988554216654,0,0,688
"TITLE: Visualization and Computer Graphics on Isotropically Emissive Volumetric Displays WORDS: rendering, used, field, techniques, model, objects, new, information, virtual, methods, technique, large, object, time, texture, light, user, image, algorithm, display",Visualization and Computer Graphics on Isotropically Emissive Volumetric Displays,0,0,0,0,0,0,0,0,0,0,0,0,0,0,0,0,0,0.9930656933,0,0,689
"TITLE: GeoBuilder: A Geometric Algorithm Visualization and Debugging System for 2D and 3D Geometric Computing WORDS: user, rendering, virtual, use, users, visual, new, techniques, analysis, volume, algorithm, different, design, time, mesh, used, model, information, interactive, features",GeoBuilder: A Geometric Algorithm Visualization and Debugging System for 2D and 3D Geometric Computing,0,0.496922211773,0,0,0,0,0.490401731657,0,0,0,0,0,0,0,0,0,0,0,0,0,690
"TITLE: Glimmer: Multilevel MDS on the GPU WORDS: algorithm, visual, field, techniques, new, surface, used, technique, different, texture, study, virtual, use, flow, graph, large, methods, design, image, time",Glimmer: Multilevel MDS on the GPU,0,0,0,0.153221291331,0.121763804537,0,0,0,0,0,0,0,0,0,0.7135284174,0,0,0,0,0,691
"TITLE: Compressed Facade Displacement Maps WORDS: information, rendering, analysis, visual, used, use, model, interactive, different, volume, algorithm, new, design, study, features, set, models, technique, techniques, user",Compressed Facade Displacement Maps,0,0.982407407097,0,0,0,0,0,0,0,0,0,0,0,0,0,0,0,0,0,0,692
"TITLE: A High Capacity 3D Steganography Algorithm WORDS: information, rendering, analysis, visual, used, use, model, interactive, different, volume, algorithm, new, design, study, features, set, models, technique, techniques, user",A High Capacity 3D Steganography Algorithm,0,0.975641025298,0,0,0,0,0,0,0,0,0,0,0,0,0,0,0,0,0,0,693
"TITLE: A New Watermarking Method for 3D Models Based on Integral Invariants WORDS: vector, image, space, algorithms, field, algorithm, performance, users, problem, virtual, volume, new, user, different, interaction, motion, analysis, used, methods, use",A New Watermarking Method for 3D Models Based on Integral Invariants,0,0,0,0,0,0,0,0,0,0.986619718065,0,0,0,0,0,0,0,0,0,0,694
"TITLE: RGB Subdivision WORDS: mesh, surface, video, algorithm, images, new, rendering, algorithms, time, space, points, geometry, volume, sets, techniques, set, meshes, large, novel, used",RGB Subdivision,0,0,0,0,0,0.984426229266,0,0,0,0,0,0,0,0,0,0,0,0,0,0,695
"TITLE: Continuous Collision Detection for Ellipsoids WORDS: algorithm, new, rendering, flow, techniques, user, virtual, novel, used, set, surface, visual, technique, image, motion, analysis, information, real, model, methods",Continuous Collision Detection for Ellipsoids,0,0,0,0,0,0,0,0,0,0,0,0.978409090577,0,0,0,0,0,0,0,0,696
"TITLE: Cosserat Nets WORDS: model, shape, surface, rendering, new, techniques, surfaces, algorithms, time, modeling, use, algorithm, user, structure, space, models, methods, used, dynamic, visual",Cosserat Nets,0,0,0,0,0,0,0,0,0,0,0,0,0,0.987162161928,0,0,0,0,0,0,697
"TITLE:  WORDS: mesh, video, technique, images, interactive, motion, surface, model, shape, set, sets, meshes, points, geometry, volume, demonstrate, rendering, techniques, new, surfaces",,0,0,0.360489630072,0,0,0.369913856271,0,0,0,0,0,0,0,0.252596513299,0,0,0,0,0,0,698
"TITLE: Multithreaded Hybrid Feature Tracking for Markerless Augmented Reality WORDS: rendering, surface, algorithm, user, time, volume, features, new, techniques, use, allows, information, interactive, propose, performance, large, objects, different, technique, framework",Multithreaded Hybrid Feature Tracking for Markerless Augmented Reality,0.0287998333116,0,0,0,0,0,0,0,0,0,0,0,0,0,0,0,0,0,0.960485880752,0,699
"TITLE:  WORDS: user, virtual, users, analysis, visual, volume, algorithm, new, techniques, model, information, interactive, time, mesh, used, models, structure, surface, error, large",,0,0,0,0,0,0,0.992016806622,0,0,0,0,0,0,0,0,0,0,0,0,0,700
"TITLE: Evaluation of Reorientation Techniques and Distractors for Walking in Large Virtual Environments WORDS: user, virtual, users, analysis, visual, volume, algorithm, new, techniques, model, information, interactive, time, mesh, used, models, structure, surface, error, large",Evaluation of Reorientation Techniques and Distractors for Walking in Large Virtual Environments,0,0,0,0,0,0,0.986619718112,0,0,0,0,0,0,0,0,0,0,0,0,0,701
"TITLE: Semiautomatic Transfer Function Initialization for Abdominal Visualization Using Self-Generating Hierarchical Radial Basis Function Networks WORDS: rendering, surface, algorithm, user, set, time, volume, model, motion, analysis, features, new, techniques, use, allows, information, interactive, propose, performance, demonstrate",Semiautomatic Transfer Function Initialization for Abdominal Visualization Using Self-Generating Hierarchical Radial Basis Function Networks,0,0.260888958542,0.346390707385,0,0,0,0,0,0,0,0,0,0,0,0,0,0,0,0.384922168785,0,702
"TITLE: A Novel Visualization Technique for Electric Power Grid Analytics WORDS: rendering, surface, algorithm, user, time, volume, allows, features, interactive, propose, use, new, performance, techniques, information, large, objects, technique, different, framework",A Novel Visualization Technique for Electric Power Grid Analytics,0,0,0,0,0,0,0,0,0,0,0,0,0,0,0,0,0,0,0.990206185405,0,703
"TITLE: Equalizer: A Scalable Parallel Rendering Framework WORDS: algorithm, used, model, image, methods, rendering, visual, surface, sets, function, shape, novel, images, set, techniques, different, proposed, domain, efficient, complex",Equalizer: A Scalable Parallel Rendering Framework,0,0,0,0,0,0,0,0,0,0,0,0,0,0,0,0,0,0,0.0834374425529,0.907562557263,704
"TITLE: Real-Time Depth-of-Field Rendering Using Anisotropically Filtered Mipmap Interpolation WORDS: rendering, used, field, techniques, model, objects, new, information, virtual, methods, technique, large, object, time, texture, light, user, image, algorithm, display",Real-Time Depth-of-Field Rendering Using Anisotropically Filtered Mipmap Interpolation,0,0,0,0,0,0,0,0,0,0,0,0,0,0,0,0,0,0.983333332754,0,0,705
"TITLE: An Adaptive Correspondence Algorithm for Modeling Scenes with Strong Interreflections WORDS: field, objects, new, large, technique, object, information, virtual, time, texture, user, light, display, algorithm, used, model, methods, image, rendering, visual",An Adaptive Correspondence Algorithm for Modeling Scenes with Strong Interreflections,0,0,0,0,0,0,0,0,0,0,0,0,0,0,0,0,0,0.813004993197,0,0.177317587249,706
"TITLE: Indexing and Retrieving Motions of Characters in Close Contact WORDS: time, interactive, demonstrate, mesh, large, new, algorithm, rendering, techniques, user, flow, used, set, visual, surface, technique, image, virtual, novel, analysis",Indexing and Retrieving Motions of Characters in Close Contact,0,0,0.817188736449,0,0,0,0,0,0,0,0.0325508459128,0.141313049051,0,0,0,0,0,0,0,0,707
"TITLE: Direct Forcing for Lagrangian Rigid-Fluid Coupling WORDS: graph, used, virtual, visual, color, field, points, analysis, rendering, surface, level, proposed, image, algorithm, user, time, volume, features, techniques, new",Direct Forcing for Lagrangian Rigid-Fluid Coupling,0,0,0,0.704454272816,0,0,0,0,0,0,0,0,0,0,0,0,0,0,0.280545726899,0,708
"TITLE: Computing Teichmuller Shape Space WORDS: surface, visual, surfaces, mesh, different, user, rendering, methods, graphics, texture, problem, algorithm, time, new, hardware, representation, mapping, novel, image, applications",Computing Teichmuller Shape Space,0,0,0.145990200565,0,0,0,0,0,0,0,0,0,0.842602055278,0,0,0,0,0,0,0,709
"TITLE: Quasi-Developable Mesh Surface Interpolation via Mesh Deformation WORDS: surface, visual, surfaces, mesh, different, user, rendering, graphics, problem, methods, algorithm, texture, time, new, hardware, representation, mapping, novel, image, applications",Quasi-Developable Mesh Surface Interpolation via Mesh Deformation,0,0,0,0,0,0.182339342277,0.0704495178293,0,0,0,0,0,0.738795298154,0,0,0,0,0,0,0,710
"TITLE: Performing Efficient NURBS Modeling Operations on the GPU WORDS: model, shape, surface, rendering, new, techniques, surfaces, algorithms, time, modeling, use, algorithm, user, structure, space, models, methods, used, dynamic, visual",Performing Efficient NURBS Modeling Operations on the GPU,0,0,0,0,0,0,0,0,0,0,0,0,0,0.989444444267,0,0,0,0,0,0,711
"TITLE: ICCD: Interactive Continuous Collision Detection between Deformable Models Using Connectivity-Based Culling WORDS: time, technique, interactive, motion, demonstrate, mesh, new, use, models, volume, large, algorithm, used, model, methods, image, rendering, visual, surface, sets",ICCD: Interactive Continuous Collision Detection between Deformable Models Using Connectivity-Based Culling,0,0,0.961099113803,0,0,0,0,0,0,0,0,0,0,0,0,0,0,0,0,0.0294272018247,712
"TITLE: Surface Mapping Using Consistent Pants Decomposition WORDS: surface, visual, surfaces, mesh, different, user, rendering, problem, algorithm, methods, graphics, texture, novel, time, new, mapping, representation, hardware, image, applications",Surface Mapping Using Consistent Pants Decomposition,0,0,0,0,0,0,0,0,0,0,0,0,0.991441441286,0,0,0,0,0,0,0,713
"TITLE: Bandwidth Selection and Reconstruction Quality in Point-Based Surfaces WORDS: model, user, rendering, information, virtual, techniques, objects, models, motion, volume, surface, different, framework, object, design, used, algorithm, sets, use, environment",Bandwidth Selection and Reconstruction Quality in Point-Based Surfaces,0,0,0,0,0,0,0,0,0,0,0.989080459412,0,0,0,0,0,0,0,0,0,714
"TITLE: A Minimal Contouring Approach to the Computation of the Reeb Graph WORDS: algorithm, model, used, methods, image, rendering, visual, function, surface, sets, shape, techniques, novel, proposed, different, domain, efficient, images, set, complex",A Minimal Contouring Approach to the Computation of the Reeb Graph,0,0,0,0,0,0,0,0,0,0,0,0,0,0,0,0,0,0,0,0.991284403506,715
"TITLE: An Efficient Solution to Systems of Multivariate Polynomial Using Expression Trees WORDS: algorithm, model, used, methods, image, rendering, visual, function, surface, sets, shape, techniques, novel, proposed, different, domain, efficient, images, set, complex",An Efficient Solution to Systems of Multivariate Polynomial Using Expression Trees,0,0,0,0,0,0,0,0,0,0,0,0,0,0,0,0,0,0,0,0.987333333106,716
"TITLE: A Compute Unified System Architecture for Graphics Clusters Incorporating Data Locality WORDS: algorithm, new, used, model, flow, user, methods, image, technique, virtual, rendering, function, surface, visual, shape, sets, analysis, information, motion, real",A Compute Unified System Architecture for Graphics Clusters Incorporating Data Locality,0,0,0,0,0,0,0,0,0,0,0,0.510435350805,0,0,0,0,0,0,0,0.477564648997,717
"TITLE: Vectorizing Cartoon Animations WORDS: volume, simulation, interactive, noise, problem, new, software, field, quality, scene, provides, surfaces, mesh, user, graphics, texture, algorithm, time, representation, mapping",Vectorizing Cartoon Animations,0,0,0,0,0,0,0,0,0,0,0,0,0.213138117411,0,0,0,0.673153882725,0,0,0.104945113066,718
"TITLE: The Lattice-Boltzmann Method on Optimal Sampling Lattices WORDS: algorithm, model, used, methods, image, rendering, visual, function, surface, sets, shape, techniques, novel, proposed, different, domain, efficient, images, set, complex",The Lattice-Boltzmann Method on Optimal Sampling Lattices,0,0,0,0,0,0,0,0,0,0,0,0,0,0,0,0,0,0,0,0.987820512593,719
"TITLE: Bas-Relief Generation Using Adaptive Histogram Equalization WORDS: vector, algorithm, space, algorithms, performance, users, problem, user, volume, interaction, visual, field, analysis, motion, used, new, surface, technique, different, flow",Bas-Relief Generation Using Adaptive Histogram Equalization,0,0,0,0,0,0,0,0,0,0.61027062514,0,0,0,0,0.380451019051,0,0,0,0,0,720
"TITLE: Photorealistic Large-Scale Urban City Model Reconstruction WORDS: rendering, used, field, techniques, objects, new, model, large, technique, methods, object, information, virtual, flow, user, time, light, algorithm, display, image",Photorealistic Large-Scale Urban City Model Reconstruction,0,0,0,0,0,0,0,0,0,0,0,0.360968104783,0,0,0,0,0.0691498526121,0.562425902088,0,0,721
"TITLE: Hardware Accelerated Segmentation of Complex Volumetric Filament Networks WORDS: user, model, rendering, techniques, information, virtual, object, objects, surface, different, motion, models, volume, framework, used, environment, use, algorithm, design, sets",Hardware Accelerated Segmentation of Complex Volumetric Filament Networks,0,0.153113811854,0,0,0,0,0,0,0.147878878336,0,0.688766345727,0,0,0,0,0,0,0,0,0,722
"TITLE: Using PVsolve to Analyze and Locate Positions of Parallel Vectors WORDS: algorithm, model, used, methods, image, rendering, visual, function, surface, sets, shape, techniques, novel, proposed, different, domain, efficient, images, set, complex",Using PVsolve to Analyze and Locate Positions of Parallel Vectors,0,0,0,0,0,0,0,0,0,0,0,0,0,0,0,0,0,0,0,0.989784945993,723
"TITLE: An Evaluation of Space Time Cube Representation of Spatiotemporal Patterns WORDS: user, virtual, users, analysis, visual, volume, algorithm, new, techniques, model, information, interactive, time, mesh, used, models, structure, surface, error, large",An Evaluation of Space Time Cube Representation of Spatiotemporal Patterns,0,0,0,0,0,0,0.991739130283,0,0,0,0,0,0,0,0,0,0,0,0,0,724
"TITLE: Case Study on Visualizing Hurricanes Using Illustration-Inspired Techniques WORDS: rendering, volume, algorithm, technique, techniques, analysis, virtual, methods, used, new, surface, visual, user, interactive, proposed, point, display, use, order, sets",Case Study on Visualizing Hurricanes Using Illustration-Inspired Techniques,0,0,0,0,0,0,0,0,0,0,0,0,0,0,0,0.989673912847,0,0,0,0,725
"TITLE: Planetary-Scale Terrain Composition WORDS: rendering, surface, algorithm, user, time, volume, allows, features, interactive, propose, use, new, performance, techniques, information, large, objects, technique, different, framework",Planetary-Scale Terrain Composition,0,0,0,0,0,0,0,0,0,0,0,0,0,0,0,0,0,0,0.989893616814,0,726
"TITLE: Distribution-Driven Visualization of Volume Data WORDS: vector, image, user, model, space, algorithms, field, performance, users, problem, new, interaction, rendering, techniques, information, virtual, analysis, methods, objects, surface",Distribution-Driven Visualization of Volume Data,0,0,0,0,0,0,0,0,0,0.571093543879,0.419722782462,0,0,0,0,0,0,0,0,0,727
"TITLE: Enhancing Realism of Wet Surfaces in Temporal Bone Surgical Simulation WORDS: rendering, volume, model, algorithm, interactive, methods, used, techniques, image, simulation, noise, quality, field, software, scene, new, surface, problem, visual, provides",Enhancing Realism of Wet Surfaces in Temporal Bone Surgical Simulation,0,0,0,0,0,0,0,0,0,0,0,0,0,0,0,0,0.989325842539,0,0,0,728
"TITLE: A Survey of Radial Methods for Information Visualization WORDS: analysis, visual, video, methods, different, user, model, time, techniques, use, novel, display, design, information, rendering, new, used, study, virtual, image",A Survey of Radial Methods for Information Visualization,0,0.255643038256,0,0,0,0,0,0.733245850421,0,0,0,0,0,0,0,0,0,0,0,0,729
"TITLE: Uncluttering Graph Layouts Using Anisotropic Diffusion and Mass Transport WORDS: algorithm, field, visual, study, virtual, flow, use, new, surface, used, technique, different, techniques, texture, design, graph, time, large, methods, image",Uncluttering Graph Layouts Using Anisotropic Diffusion and Mass Transport,0,0,0,0,0,0,0,0,0,0,0,0,0,0,0.990865384431,0,0,0,0,0,730
"TITLE: Efficient and Accurate Sound Propagation Using Adaptive Rectangular Decomposition WORDS: information, analysis, surfaces, framework, use, applications, flow, algorithm, design, space, user, algorithms, technique, local, used, model, volume, features, study, models",Efficient and Accurate Sound Propagation Using Adaptive Rectangular Decomposition,0,0.309023119188,0,0,0,0,0,0,0.383934633511,0,0,0,0,0,0,0,0.134300774254,0,0,0.165903866073,731
"TITLE: Efficient LBM Visual Simulation on Face-Centered Cubic Lattices WORDS: field, study, virtual, use, flow, new, technique, texture, time, graph, large, design, interactive, visualizations, demonstrate, surfaces, algorithm, mesh, optimization, control",Efficient LBM Visual Simulation on Face-Centered Cubic Lattices,0,0,0,0,0.219496690659,0,0,0,0,0.0794678401853,0,0,0,0.157575923015,0.450560150261,0,0,0,0,0.0853236381686,732
"TITLE: Image-Based Modeling of the Human Eye WORDS: analysis, visual, new, interactive, features, set, technique, study, user, model, rendering, techniques, information, virtual, objects, surface, different, object, models, motion",Image-Based Modeling of the Human Eye,0,0.730954748858,0,0,0,0,0,0,0,0,0.256369194562,0,0,0,0,0,0,0,0,0,733
"TITLE: Refilming with Depth-Inferred Videos WORDS: mesh, surface, video, algorithm, images, new, rendering, algorithms, time, space, points, geometry, volume, sets, techniques, set, meshes, large, novel, used",Refilming with Depth-Inferred Videos,0,0,0,0,0,0.989325842518,0,0,0,0,0,0,0,0,0,0,0,0,0,0,734
"TITLE: TransCAIP: A Live 3D TV System Using a Camera Array and an Integral Photography Display with Interactive Control of Viewing Parameters WORDS: field, fields, flow, interactive, rendering, analysis, design, surfaces, points, visual, technique, techniques, simulation, user, new, allows, multiple, novel, problem, methods",TransCAIP: A Live 3D TV System Using a Camera Array and an Integral Photography Display with Interactive Control of Viewing Parameters,0.989560439345,0,0,0,0,0,0,0,0,0,0,0,0,0,0,0,0,0,0,0,735
"TITLE: Multiresolution Mean Shift Clustering Algorithm for Shape Interpolation WORDS: algorithm, used, model, methods, image, rendering, function, surface, visual, shape, sets, volume, images, set, different, techniques, novel, domain, proposed, efficient",Multiresolution Mean Shift Clustering Algorithm for Shape Interpolation,0,0,0,0,0,0,0,0,0,0,0,0,0,0.0773757506081,0,0,0.284276144548,0,0,0.629932263082,736
"TITLE: Compatible Embedding for 2D Shape Animation WORDS: users, volume, time, mesh, interactive, structure, large, models, error, new, algorithm, rendering, techniques, user, flow, visual, set, surface, used, technique",Compatible Embedding for 2D Shape Animation,0,0,0,0,0,0,0.787884817425,0,0,0,0,0.195792862794,0,0,0,0,0,0,0,0,737
"TITLE: ABySS-Explorer: Visualizing Genome Sequence Assemblies WORDS: analysis, visual, methods, video, model, different, user, time, design, novel, use, display, techniques, new, virtual, rendering, used, image, applications, study",ABySS-Explorer: Visualizing Genome Sequence Assemblies,0,0,0,0,0,0,0,0.989204545235,0,0,0,0,0,0,0,0,0,0,0,0,738
"TITLE: Constructing Overview + Detail Dendrogram-Matrix Views WORDS: rendering, volume, model, algorithm, techniques, used, simulation, interactive, methods, image, noise, quality, visual, new, surface, software, field, problem, scene, provides",Constructing Overview + Detail Dendrogram-Matrix Views,0,0,0,0.369469251067,0,0,0,0,0,0,0,0,0,0,0,0,0.622422640679,0,0,0,739
"TITLE: MizBee: A Multiscale Synteny Browser WORDS: model, user, rendering, information, virtual, techniques, objects, models, motion, volume, surface, different, framework, object, design, used, algorithm, sets, use, environment",MizBee: A Multiscale Synteny Browser,0,0,0,0,0,0,0,0,0,0,0.991037735659,0,0,0,0,0,0,0,0,0,740
"TITLE: GeneShelf: A Web-based Visual Interface for Large Gene Expression Time-Series Data Repositories WORDS: video, images, algorithms, space, set, geometry, sets, meshes, points, volume, surface, rendering, used, field, techniques, visual, surfaces, objects, new, model",GeneShelf: A Web-based Visual Interface for Large Gene Expression Time-Series Data Repositories,0,0,0,0,0,0.585809479235,0,0,0,0,0,0,0.165879543161,0,0,0,0,0.240058550274,0,0,741
"TITLE: Spatiotemporal Analysis of Sensor Logs using Growth Ring Maps WORDS: algorithm, time, set, technique, rendering, model, interactive, motion, techniques, mesh, volume, models, used, new, surface, sets, use, demonstrate, large, novel",Spatiotemporal Analysis of Sensor Logs using Growth Ring Maps,0,0,0.992857142723,0,0,0,0,0,0,0,0,0,0,0,0,0,0,0,0,0,742
"TITLE: A Nested Model for Visualization Design and Validation WORDS: volume, simulation, interactive, noise, problem, new, provides, software, field, quality, scene, algorithm, used, model, methods, image, rendering, function, surface, visual",A Nested Model for Visualization Design and Validation,0,0,0,0,0,0,0,0,0,0,0,0,0,0,0,0,0.84610664387,0,0,0.141393355876,743
"TITLE: Conjunctive Visual Forms WORDS: surface, model, shape, rendering, new, techniques, surfaces, structure, algorithms, time, modeling, use, algorithm, user, space, visual, dynamic, used, models, methods",Conjunctive Visual Forms,0,0,0,0,0,0,0,0.0570261120314,0,0,0,0,0.25496234445,0.679157376664,0,0,0,0,0,0,744
"TITLE: Interaction Techniques for Selecting and Manipulating Subgraphs in Network Visualizations WORDS: information, analysis, visual, algorithm, different, design, features, user, study, time, set, technique, rendering, techniques, model, interactive, motion, demonstrate, mesh, new",Interaction Techniques for Selecting and Manipulating Subgraphs in Network Visualizations,0,0.69153629488,0.298236432202,0,0,0,0,0,0,0,0,0,0,0,0,0,0,0,0,0,745
"TITLE: ActiviTree: Interactive Visual Exploration of Sequences in Event-Based Data Using Graph Similarity WORDS: algorithm, model, used, methods, image, rendering, visual, function, surface, sets, shape, techniques, novel, proposed, different, domain, efficient, images, set, complex",ActiviTree: Interactive Visual Exploration of Sequences in Event-Based Data Using Graph Similarity,0,0,0,0,0,0,0,0,0,0,0,0,0,0,0,0,0,0,0,0.98908045954,746
"TITLE:  WORDS: model, user, rendering, information, virtual, techniques, objects, models, motion, volume, surface, different, framework, object, design, used, algorithm, sets, use, environment",,0,0,0,0,0,0,0,0,0,0,0.989080459541,0,0,0,0,0,0,0,0,0,747
