name,group,T1,T2,T3,T4,T5,T6,T7,T8,T9,T10,T11,T12,T13,T14,T15,T16,T17,T18,T19,T20,ID
"TITLE: Optimal sampling for hemicubes WORDS: methods, analysis, surfaces, surface, techniques, framework, new, used, proposed, flow, algorithm, applications, rendering, algorithms, space, visual, technique, user, local, efficient",Optimal sampling for hemicubes,0.181791114028,0,0,0,0,0,0,0,0.802954648385,0,0,0,0,0,0,0,0,0,0,0,0
"TITLE: Volume rendering of DCT-based compressed 3D scalar data WORDS: information, rendering, analysis, visual, used, use, model, interactive, different, volume, algorithm, new, design, study, features, set, models, technique, techniques, user",Volume rendering of DCT-based compressed 3D scalar data,0,0.986029411527,0,0,0,0,0,0,0,0,0,0,0,0,0,0,0,0,0,0,1
"TITLE: Visualization of multidimensional shape and texture features in laser range data using complex-valued Gabor wavelets WORDS: framework, proposed, applications, surface, model, shape, efficient, local, rendering, new, techniques, surfaces, algorithms, modeling, user, structure, time, use, algorithm, space",Visualization of multidimensional shape and texture features in laser range data using complex-valued Gabor wavelets,0,0,0,0,0,0,0,0,0.590217612849,0,0,0.0676213949804,0,0.332716547531,0,0,0,0,0,0,2
"TITLE: Vision-an architecture for global illumination calculations WORDS: model, shape, surfaces, algorithms, modeling, structure, space, used, dynamic, visual, models, methods, rendering, surface, algorithm, user, analysis, volume, time, features",Vision-an architecture for global illumination calculations,0,0,0,0,0,0,0,0,0.089370261688,0,0,0,0,0.796931215513,0,0,0,0,0.103457558735,0,3
"TITLE: Visualizing network data WORDS: rendering, volume, model, algorithm, interactive, methods, used, techniques, image, simulation, noise, quality, field, software, scene, new, surface, problem, visual, provides",Visualizing network data,0,0,0,0,0,0,0,0,0,0,0,0,0,0,0,0,0.986428571063,0,0,0,4
"TITLE: Real time responsive animation with personality WORDS: different, model, interactive, volume, design, features, set, technique, techniques, study, models, algorithm, graph, surface, used, user, information, virtual, rendering, field",Real time responsive animation with personality,0,0.8810405689,0,0.111928180951,0,0,0,0,0,0,0,0,0,0,0,0,0,0,0,0,5
"TITLE: Quaternion frame approach to streamline visualization WORDS: mesh, surface, video, images, rendering, time, set, geometry, sets, meshes, points, techniques, vector, image, large, novel, algorithms, space, field, algorithm",Quaternion frame approach to streamline visualization,0,0,0,0,0,0.670739702119,0,0,0,0.317721836117,0,0,0,0,0,0,0,0,0,0,6
"TITLE:  WORDS: new, algorithm, rendering, techniques, user, flow, technique, used, set, surface, visual, image, novel, virtual, motion, information, analysis, model, methods, real",,0,0,0,0,0,0,0,0,0.0896181892681,0,0,0.894018174096,0,0,0,0,0,0,0,0,7
"TITLE:  WORDS: fields, algorithm, rendering, interactive, surfaces, simulation, points, visual, field, multiple, allows, novel, different, new, surface, used, technique, techniques, use, study",,0.572671020898,0,0,0,0,0,0,0,0,0.0435132007083,0,0,0,0,0.371496937589,0,0,0,0,0,8
"TITLE: A predictor-corrector technique for visualizing unsteady flow WORDS: algorithm, new, rendering, flow, techniques, user, virtual, novel, used, set, surface, visual, technique, image, motion, analysis, information, real, model, methods",A predictor-corrector technique for visualizing unsteady flow,0,0,0,0,0,0,0,0,0,0,0,0.982727272373,0,0,0,0,0,0,0,0,9
"TITLE: Grouping volume renderers for enhanced visualization in computational fluid dynamics WORDS: rendering, used, techniques, field, objects, new, model, technique, large, object, information, virtual, methods, time, image, user, light, algorithm, display, texture",Grouping volume renderers for enhanced visualization in computational fluid dynamics,0,0,0.207872849774,0,0,0,0,0,0,0,0.141909188047,0,0,0,0,0,0,0.64227403678,0,0,10
"TITLE: Visualization of geometric algorithms WORDS: algorithm, used, model, methods, image, rendering, visual, function, surface, shape, sets, information, domain, images, set, different, techniques, novel, proposed, efficient",Visualization of geometric algorithms,0,0.255745298666,0,0,0,0,0,0,0,0,0,0,0,0,0,0,0,0,0,0.731211222829,11
"TITLE:  WORDS: vector, image, space, algorithms, field, algorithm, performance, users, problem, virtual, volume, new, user, different, interaction, motion, analysis, used, methods, use",,0,0,0,0,0,0,0,0,0,0.989893616811,0,0,0,0,0,0,0,0,0,0,12
"TITLE: Optical models for direct volume rendering WORDS: users, analysis, time, mesh, rendering, volume, structure, large, error, model, algorithm, techniques, used, simulation, interactive, methods, image, user, scene, visual",Optical models for direct volume rendering,0,0,0,0,0,0,0.567148963521,0,0,0,0.147864904388,0,0,0,0,0,0.271704881814,0,0,0,13
"TITLE: Calibration requirements and procedures for a monitor-based augmented reality system WORDS: rendering, used, field, techniques, model, objects, new, information, virtual, methods, technique, large, object, time, texture, light, user, image, algorithm, display",Calibration requirements and procedures for a monitor-based augmented reality system,0,0,0,0,0,0,0,0,0,0,0,0,0,0,0,0,0,0.988823529202,0,0,14
"TITLE: Line art rendering via a coverage of isoparametric curves WORDS: field, fields, flow, interactive, rendering, analysis, design, surfaces, points, visual, technique, techniques, simulation, user, new, allows, multiple, novel, problem, methods",Line art rendering via a coverage of isoparametric curves,0.980208332864,0,0,0,0,0,0,0,0,0,0,0,0,0,0,0,0,0,0,0,15
"TITLE: Dynamic color quantization of video sequences WORDS: algorithm, model, used, methods, image, rendering, visual, function, surface, sets, shape, techniques, novel, proposed, different, domain, efficient, images, set, complex",Dynamic color quantization of video sequences,0,0,0,0,0,0,0,0,0,0,0,0,0,0,0,0,0,0,0,0.989784945968,16
"TITLE: On particle path generation based on quadrilinear interpolation and Bernstein-Bezier polynomials WORDS: rendering, volume, algorithm, technique, techniques, analysis, virtual, methods, used, new, surface, visual, user, interactive, proposed, point, display, use, order, sets",On particle path generation based on quadrilinear interpolation and Bernstein-Bezier polynomials,0,0,0,0,0,0,0,0,0,0,0,0,0,0,0,0.980612244514,0,0,0,0,17
"TITLE: A unified hierarchical algorithm for global illumination with scattering volumes and object clusters WORDS: rendering, volume, algorithm, technique, techniques, analysis, virtual, methods, used, new, surface, visual, user, interactive, proposed, point, display, use, order, sets",A unified hierarchical algorithm for global illumination with scattering volumes and object clusters,0,0,0,0,0,0,0,0,0,0,0,0,0,0,0,0.988953488166,0,0,0,0,18
"TITLE: Collision detection for interactive graphics applications WORDS: algorithm, time, set, technique, rendering, model, interactive, motion, techniques, mesh, volume, models, used, new, surface, sets, use, demonstrate, large, novel",Collision detection for interactive graphics applications,0,0,0.989444444246,0,0,0,0,0,0,0,0,0,0,0,0,0,0,0,0,0,19
"TITLE: Hybrid scan-conversion of circles WORDS: vector, image, space, algorithms, field, algorithm, performance, users, problem, virtual, volume, new, user, different, interaction, motion, analysis, used, methods, use",Hybrid scan-conversion of circles,0,0,0,0,0,0,0,0,0,0.974999999615,0,0,0,0,0,0,0,0,0,0,20
"TITLE: Modeling and visualization of knitwear WORDS: algorithm, time, set, technique, rendering, model, interactive, motion, techniques, mesh, volume, models, used, new, surface, sets, use, demonstrate, large, novel",Modeling and visualization of knitwear,0,0,0.977906976378,0,0,0,0,0,0,0,0,0,0,0,0,0,0,0,0,0,21
"TITLE: Specification by-example of virtual agents behavior WORDS: algorithm, information, virtual, graph, surface, used, user, rendering, field, points, analysis, visual, new, color, level, propose, use, large, image, proposed",Specification by-example of virtual agents behavior,0,0,0,0.989204545323,0,0,0,0,0,0,0,0,0,0,0,0,0,0,0,0,22
"TITLE: Exploiting triangulated surface extraction using tetrahedral decomposition WORDS: analysis, framework, proposed, flow, applications, surface, model, shape, technique, efficient, local, rendering, new, techniques, surfaces, algorithms, modeling, user, structure, time",Exploiting triangulated surface extraction using tetrahedral decomposition,0,0,0,0,0,0,0,0,0.664388557548,0,0,0,0,0.310742599515,0,0,0,0,0,0,23
"TITLE: Octree-R: an adaptive octree for efficient ray tracing WORDS: vector, image, space, algorithms, field, algorithm, performance, users, problem, virtual, volume, new, user, different, interaction, motion, analysis, used, methods, use",Octree-R: an adaptive octree for efficient ray tracing,0,0,0,0,0,0,0,0,0,0.984426229242,0,0,0,0,0,0,0,0,0,0,24
"TITLE: Automatic isosurface propagation using an extrema graph and sorted boundary cell lists WORDS: methods, analysis, surfaces, surface, techniques, framework, new, proposed, flow, used, algorithm, applications, rendering, algorithms, space, local, efficient, visual, technique, user",Automatic isosurface propagation using an extrema graph and sorted boundary cell lists,0,0,0,0,0,0,0,0,0.988823529269,0,0,0,0,0,0,0,0,0,0,0,25
"TITLE: D-NURBS: a physics-based framework for geometric design WORDS: fields, flow, surface, shape, analysis, design, simulation, points, surfaces, structure, use, algorithms, modeling, multiple, allows, problem, space, visual, models, dynamic",D-NURBS: a physics-based framework for geometric design,0.440831322618,0,0.133020929619,0,0,0,0,0,0,0,0,0,0,0.332733658347,0,0,0,0.0868567122123,0,0,26
"TITLE: Function representation for sweeping by a moving solid WORDS: rendering, surface, algorithm, user, analysis, time, volume, visual, used, features, new, techniques, use, allows, information, interactive, propose, performance, model, design",Function representation for sweeping by a moving solid,0,0.471668846242,0,0,0,0,0,0,0,0,0,0,0,0,0,0,0,0,0.519840587562,0,27
"TITLE: Shape description by medial surface construction WORDS: model, shape, surface, rendering, new, techniques, surfaces, algorithms, time, modeling, use, algorithm, user, structure, space, models, methods, used, dynamic, visual",Shape description by medial surface construction,0,0,0,0,0,0,0,0,0,0,0,0,0,0.981730768848,0,0,0,0,0,0,28
"TITLE: Volume-preserving free-form solids WORDS: rendering, volume, techniques, technique, algorithm, video, different, model, visual, new, surface, used, user, analysis, virtual, methods, time, novel, design, point",Volume-preserving free-form solids,0,0,0,0,0,0,0.0192937325128,0.440350457347,0,0,0,0,0,0,0,0.532411884738,0,0,0,0,29
"TITLE: A fast method for estimating discrete field values in early engineering design WORDS: analysis, visual, methods, video, model, different, user, time, design, novel, use, display, techniques, new, virtual, rendering, used, image, applications, study",A fast method for estimating discrete field values in early engineering design,0,0,0,0,0,0,0,0.988271604686,0,0,0,0,0,0,0,0,0,0,0,0,30
"TITLE: A road map to solid modeling WORDS: video, different, model, time, novel, design, study, image, applications, rendering, volume, technique, techniques, algorithm, visual, new, surface, used, analysis, virtual",A road map to solid modeling,0,0,0,0,0,0,0,0.901885381333,0,0,0,0,0,0,0,0.0913982006065,0,0,0,0,31
"TITLE: Solving geometric constraints by homotopy WORDS: methods, analysis, surfaces, surface, techniques, framework, new, proposed, flow, used, algorithm, applications, rendering, algorithms, space, local, efficient, visual, technique, user",Solving geometric constraints by homotopy,0,0,0,0,0,0,0,0,0.952499998825,0,0,0,0,0,0,0,0,0,0,0,32
"TITLE: An algorithm for the medial axis transform of 3D polyhedral solids WORDS: algorithm, graph, used, surface, user, information, virtual, rendering, visual, new, color, field, analysis, points, large, use, level, propose, proposed, image",An algorithm for the medial axis transform of 3D polyhedral solids,0,0,0.266272977363,0.72415255437,0,0,0,0,0,0,0,0,0,0,0,0,0,0,0,0,33
"TITLE: Efficient triangular surface approximations using wavelets and quadtree data structures WORDS: surface, visual, surfaces, mesh, different, user, rendering, problem, algorithm, methods, graphics, texture, novel, time, new, mapping, representation, hardware, image, applications",Efficient triangular surface approximations using wavelets and quadtree data structures,0,0,0,0,0,0,0,0,0,0,0,0,0.992213114623,0,0,0,0,0,0,0,34
"TITLE: Controlled topology simplification WORDS: methods, analysis, surfaces, surface, techniques, framework, new, proposed, flow, used, algorithm, applications, rendering, algorithms, space, local, efficient, visual, technique, user",Controlled topology simplification,0,0,0,0,0,0,0,0,0.983620689319,0,0,0,0,0,0,0,0,0,0,0,35
"TITLE: Interactive time-dependent particle tracing using tetrahedral decomposition WORDS: rendering, volume, techniques, technique, algorithm, used, visual, new, surface, methods, user, analysis, virtual, sets, use, interactive, proposed, point, display, order",Interactive time-dependent particle tracing using tetrahedral decomposition,0,0,0.314253512182,0,0,0,0,0,0,0,0,0,0,0,0,0.675634128077,0,0,0,0,36
"TITLE:  WORDS: algorithm, field, visual, study, virtual, flow, use, new, surface, used, technique, different, techniques, texture, design, graph, time, large, methods, image",,0,0,0,0,0,0,0,0,0,0,0,0,0,0,0.984920634202,0,0,0,0,0,37
"TITLE: Feature extraction and iconic visualization WORDS: surface, model, shape, rendering, new, techniques, surfaces, structure, algorithms, time, modeling, use, user, algorithm, space, used, dynamic, visual, models, methods",Feature extraction and iconic visualization,0,0,0,0,0,0,0,0,0,0,0.191224305976,0,0,0.794021595364,0,0,0,0,0,0,38
"TITLE: Splatting of non rectilinear volumes through stochastic resampling WORDS: algorithm, new, rendering, flow, techniques, user, virtual, novel, used, set, surface, visual, technique, image, motion, analysis, information, real, model, methods",Splatting of non rectilinear volumes through stochastic resampling,0,0,0,0,0,0,0,0,0,0,0,0.985156249725,0,0,0,0,0,0,0,0,39
"TITLE: Volumetric data exploration using interval volume WORDS: rendering, volume, model, algorithm, interactive, methods, used, techniques, image, simulation, noise, quality, field, software, scene, new, surface, problem, visual, provides",Volumetric data exploration using interval volume,0,0,0,0,0,0,0,0,0,0,0,0,0,0,0,0,0.989080459264,0,0,0,40
"TITLE: Glyphs for visualizing uncertainty in vector fields WORDS: vector, image, space, algorithms, field, algorithm, performance, users, problem, virtual, volume, new, user, different, interaction, motion, analysis, used, methods, use",Glyphs for visualizing uncertainty in vector fields,0,0,0,0,0,0,0,0,0,0.990776698885,0,0,0,0,0,0,0,0,0,0,41
"TITLE:  WORDS: use, different, interactive, volume, design, features, study, models, new, algorithm, rendering, flow, techniques, user, visual, set, surface, used, technique, virtual",,0,0.874316365264,0,0,0,0,0,0,0,0,0,0.117647920303,0,0,0,0,0,0,0,0,42
"TITLE: Frequency analysis of gradient estimators in volume rendering WORDS: rendering, used, field, techniques, model, objects, new, information, virtual, methods, technique, large, object, time, texture, light, user, image, algorithm, display",Frequency analysis of gradient estimators in volume rendering,0,0,0,0,0,0,0,0,0,0,0,0,0,0,0,0,0,0.981730768857,0,0,43
"TITLE: A real-time photo-realistic visual flythrough WORDS: rendering, volume, model, algorithm, information, used, techniques, simulation, interactive, methods, image, noise, field, scene, visual, problem, new, surface, quality, software",A real-time photo-realistic visual flythrough,0,0.305603763592,0,0,0,0,0,0,0,0,0,0,0,0,0,0,0.669396230916,0,0,0,44
"TITLE: RIVA: a versatile parallel rendering system for interactive scientific visualization WORDS: algorithm, used, model, graph, user, information, virtual, methods, image, field, new, color, analysis, points, rendering, visual, function, surface, shape, sets",RIVA: a versatile parallel rendering system for interactive scientific visualization,0,0.123288933911,0,0.46514556038,0,0,0,0,0,0,0,0,0,0,0,0,0,0,0,0.401565505508,45
"TITLE: Analysis of a parallel volume rendering system based on the shear-warp factorization WORDS: algorithm, time, set, technique, rendering, model, interactive, motion, techniques, mesh, volume, models, used, new, surface, sets, use, demonstrate, large, novel",Analysis of a parallel volume rendering system based on the shear-warp factorization,0,0,0.99103773568,0,0,0,0,0,0,0,0,0,0,0,0,0,0,0,0,0,46
"TITLE: Image composition schemes for sort-last polygon rendering on 2D mesh multicomputers WORDS: rendering, volume, model, algorithm, used, techniques, simulation, interactive, methods, image, shape, noise, scene, new, surface, visual, provides, software, field, quality",Image composition schemes for sort-last polygon rendering on 2D mesh multicomputers,0,0,0,0,0,0,0,0,0,0,0,0,0,0.300195023242,0,0,0.689090690841,0,0,0,47
"TITLE: Fractal volume compression WORDS: vector, image, space, algorithms, field, algorithm, performance, users, problem, virtual, volume, new, user, different, interaction, motion, analysis, used, methods, use",Fractal volume compression,0,0,0,0,0,0,0,0,0,0.989999999851,0,0,0,0,0,0,0,0,0,0,48
"TITLE: Implementation and analysis of an image-based global illumination framework for animated environments WORDS: users, visual, new, analysis, time, mesh, interactive, structure, large, error, user, model, rendering, techniques, information, virtual, set, technique, objects, surface",Implementation and analysis of an image-based global illumination framework for animated environments,0,0,0.157588917647,0,0,0,0.607197044681,0,0,0,0.216296968196,0,0,0,0,0,0,0,0,0,49
"TITLE: Structured penumbral irradiance computation WORDS: rendering, surface, algorithm, user, time, volume, allows, features, interactive, propose, use, new, performance, techniques, information, large, objects, technique, different, framework",Structured penumbral irradiance computation,0,0,0,0,0,0,0,0,0,0,0,0,0,0,0,0,0,0,0.989999999798,0,50
"TITLE: Visualizing unstructured flow data using dual stream functions WORDS: time, set, model, interactive, motion, methods, demonstrate, mesh, sets, use, models, volume, analysis, surfaces, techniques, surface, framework, large, novel, used",Visualizing unstructured flow data using dual stream functions,0,0,0.614216604682,0,0,0,0,0,0.369116728355,0,0,0,0,0,0,0,0,0,0,0,51
"TITLE: Reconstruction error characterization and control: a sampling theory approach WORDS: rendering, surface, algorithm, user, time, volume, allows, features, interactive, propose, use, new, performance, techniques, information, large, objects, technique, different, framework",Reconstruction error characterization and control: a sampling theory approach,0,0,0,0,0,0,0,0,0,0,0,0,0,0,0,0,0,0,0.98538461511,0,52
"TITLE: Interactive display of large NURBS models WORDS: model, shape, surface, rendering, new, techniques, surfaces, algorithms, time, modeling, use, algorithm, user, structure, space, models, methods, used, dynamic, visual",Interactive display of large NURBS models,0,0,0,0,0,0,0,0,0,0,0,0,0,0.986986301026,0,0,0,0,0,0,53
"TITLE: Multipole expansion of the light vector WORDS: algorithm, new, rendering, flow, techniques, user, virtual, novel, used, set, surface, visual, technique, image, motion, analysis, information, real, model, methods",Multipole expansion of the light vector,0,0,0,0,0,0,0,0,0,0,0,0.990499999796,0,0,0,0,0,0,0,0,54
"TITLE: Error and complexity of random walk Monte Carlo radiosity WORDS: algorithm, field, visual, study, virtual, flow, use, new, surface, used, technique, different, techniques, texture, design, graph, time, large, methods, image",Error and complexity of random walk Monte Carlo radiosity,0,0,0,0,0,0,0,0,0,0,0,0,0,0,0.986986301227,0,0,0,0,0,55
"TITLE: The discrete analytical hyperspheres WORDS: algorithm, time, set, technique, rendering, model, interactive, motion, techniques, mesh, volume, models, used, new, surface, sets, use, demonstrate, large, novel",The discrete analytical hyperspheres,0,0,0.982407407109,0,0,0,0,0,0,0,0,0,0,0,0,0,0,0,0,0,56
"TITLE: Incremental algorithms for collision detection between polygonal models WORDS: information, analysis, visual, different, design, features, user, study, algorithm, time, set, technique, rendering, techniques, model, interactive, motion, demonstrate, mesh, new",Incremental algorithms for collision detection between polygonal models,0,0.78977836521,0.201398105206,0,0,0,0,0,0,0,0,0,0,0,0,0,0,0,0,0,57
"TITLE: Animation of deformable models using implicit surfaces WORDS: model, shape, surface, rendering, new, techniques, surfaces, algorithms, time, modeling, use, algorithm, user, structure, space, models, methods, used, dynamic, visual",Animation of deformable models using implicit surfaces,0,0,0,0,0,0,0,0,0,0,0,0,0,0.990104166509,0,0,0,0,0,0,58
"TITLE:  WORDS: algorithm, graph, surface, used, user, information, virtual, rendering, analysis, visual, new, color, field, points, large, level, propose, proposed, use, image",,0.162189865594,0,0,0.829628316068,0,0,0,0,0,0,0,0,0,0,0,0,0,0,0,0,59
"TITLE: Virtual Data Visualizer WORDS: algorithm, new, rendering, flow, techniques, user, virtual, novel, used, set, surface, visual, technique, image, motion, analysis, information, real, model, methods",Virtual Data Visualizer,0,0,0,0,0,0,0,0,0,0,0,0.989325842444,0,0,0,0,0,0,0,0,60
"TITLE: Tracking and visualizing turbulent 3D features WORDS: rendering, volume, technique, algorithm, techniques, used, visual, new, surface, user, analysis, virtual, methods, mesh, point, sets, use, interactive, proposed, display",Tracking and visualizing turbulent 3D features,0,0,0,0,0,0.311424479461,0,0,0,0,0,0,0,0,0,0.678463160755,0,0,0,0,61
"TITLE: The lazy sweep ray casting algorithm for rendering irregular grids WORDS: mesh, surface, video, algorithm, images, new, rendering, algorithms, space, set, techniques, volume, meshes, points, geometry, time, sets, graph, user, information",The lazy sweep ray casting algorithm for rendering irregular grids,0,0,0,0.403708675048,0,0.585447951243,0,0,0,0,0,0,0,0,0,0,0,0,0,0,62
"TITLE: Speeding up isosurface extraction using interval trees WORDS: methods, analysis, surfaces, surface, techniques, framework, new, used, flow, proposed, algorithm, applications, rendering, algorithms, space, visual, technique, local, user, efficient",Speeding up isosurface extraction using interval trees,0,0,0,0,0,0,0,0.322287156285,0.669301628586,0,0,0,0,0,0,0,0,0,0,0,63
"TITLE: Evaluation and design of filters using a Taylor series expansion WORDS: model, interactive, models, demonstrate, visualizations, methods, mesh, optimization, control, use, novel, analysis, surfaces, surface, techniques, framework, used, new, algorithm, applications",Evaluation and design of filters using a Taylor series expansion,0,0,0,0,0.684062456121,0,0,0,0.305223257947,0,0,0,0,0,0,0,0,0,0,0,64
"TITLE: Fast display of illuminated field lines WORDS: rendering, used, field, techniques, model, objects, new, information, virtual, methods, technique, large, object, time, texture, light, user, image, algorithm, display",Fast display of illuminated field lines,0,0,0,0,0,0,0,0,0,0,0,0,0,0,0,0,0,0.990865384436,0,0,65
"TITLE: Adaptive real-time level-of-detail based rendering for polygonal models WORDS: algorithm, used, model, methods, image, surfaces, rendering, visual, surface, sets, function, shape, mesh, efficient, images, set, techniques, different, proposed, domain",Adaptive real-time level-of-detail based rendering for polygonal models,0,0,0.212386164148,0,0,0,0,0,0,0,0,0,0.275736230109,0,0,0,0,0,0,0.499905774497,66
"TITLE: Conveying the 3D shape of smoothly curving transparent surfaces via texture WORDS: rendering, volume, technique, algorithm, techniques, visual, new, surface, used, user, analysis, virtual, methods, surfaces, point, use, interactive, order, proposed, display",Conveying the 3D shape of smoothly curving transparent surfaces via texture,0,0,0,0,0,0,0,0,0,0,0,0,0.288784974212,0,0,0.704015025637,0,0,0,0,67
"TITLE: Dynamic free-form deformations for animation synthesis WORDS: surface, model, shape, rendering, new, techniques, surfaces, structure, algorithms, time, modeling, user, use, algorithm, space, used, visual, dynamic, models, methods",Dynamic free-form deformations for animation synthesis,0,0,0,0,0.104318528578,0,0,0,0,0,0,0,0,0.887573363178,0,0,0,0,0,0,68
"TITLE: Complex character positioning based on a compatible flow model of multiple supports WORDS: vector, image, space, algorithms, field, rendering, users, problem, virtual, interaction, surface, algorithm, analysis, used, motion, methods, user, time, volume, features",Complex character positioning based on a compatible flow model of multiple supports,0,0,0,0,0,0,0,0,0,0.68156280284,0,0,0,0,0,0,0,0,0.306437196921,0,69
"TITLE: Physically-based stochastic simplification of mathematical knots WORDS: methods, analysis, surfaces, surface, techniques, framework, new, proposed, flow, used, algorithm, applications, rendering, algorithms, space, local, efficient, visual, technique, user",Physically-based stochastic simplification of mathematical knots,0,0,0,0,0,0,0,0,0.991666666527,0,0,0,0,0,0,0,0,0,0,0,70
