"TITLE: Semantic Interaction for Sensemaking: Inferring Analytical Reasoning for Model Steering WORDS: users, use, design, visualizations, interactive, space, large, new, different, study",Semantic Interaction for Sensemaking: Inferring Analytical Reasoning for Model Steering,3,5,8,10,9,1,6,2,7,4,193
"TITLE: Visual Analytics Methodology for Eye Movement Studies WORDS: new, users, use, design, visualizations, interactive, used, novel, flow, tasks",Visual Analytics Methodology for Eye Movement Studies,10,9,3,2,6,1,5,7,8,4,194
"TITLE: A Visual Analytics Approach to Multiscale Exploration of Environmental Time Series WORDS: users, use, design, visualizations, interactive, new, space, large, different, study",A Visual Analytics Approach to Multiscale Exploration of Environmental Time Series,2,5,10,8,4,3,6,9,1,7,195
"TITLE: The User Puzzle---Explaining the Interaction with Visual Analytics Systems WORDS: new, novel, users, use, design, visualizations, interactive, volume, different, study",The User Puzzle---Explaining the Interaction with Visual Analytics Systems,2,5,4,8,3,1,10,9,7,6,196
"TITLE: Enterprise Data Analysis and Visualization: An Interview Study WORDS: new, users, use, design, visualizations, interactive, space, large, novel, volume",Enterprise Data Analysis and Visualization: An Interview Study,3,6,10,7,1,8,9,5,2,4,197
"TITLE: Visual cluster exploration of web clickstream data WORDS: new, volume, users, use, design, visualizations, interactive, novel, flow, tasks",Visual cluster exploration of web clickstream data,1,8,7,10,3,9,5,6,2,4,198
"TITLE: An adaptive parameter space-filling algorithm for highly interactive cluster exploration WORDS: new, users, use, design, visualizations, interactive, used, volume, novel, space",An adaptive parameter space-filling algorithm for highly interactive cluster exploration,2,9,10,5,4,1,8,7,3,6,199
"TITLE: Inter-active learning of ad-hoc classifiers for video visual analytics WORDS: used, new, users, use, design, visualizations, interactive, flow, tasks, novel",Inter-active learning of ad-hoc classifiers for video visual analytics,3,5,8,2,1,10,4,6,7,9,200
"TITLE: A correlative analysis process in a visual analytics environment WORDS: users, use, design, visualizations, interactive, used, new, different, study, technique",A correlative analysis process in a visual analytics environment,4,10,6,3,1,9,2,5,7,8,201
"TITLE: Visual pattern discovery using random projections WORDS: new, users, use, design, visualizations, interactive, space, large, flow, tasks",Visual pattern discovery using random projections,2,7,6,3,10,8,9,4,1,5,202
"TITLE: iLAMP: Exploring high-dimensional spacing through backward multidimensional projection WORDS: new, space, large, volume, used, users, use, design, visualizations, interactive",iLAMP: Exploring high-dimensional spacing through backward multidimensional projection,6,1,4,7,9,10,8,3,2,5,203
"TITLE: Subspace search and visualization to make sense of alternative clusterings in high-dimensional data WORDS: new, users, use, design, visualizations, interactive, novel, volume, different, study",Subspace search and visualization to make sense of alternative clusterings in high-dimensional data,5,6,10,9,7,1,8,4,3,2,204
"TITLE:  WORDS: new, flow, tasks, used, users, use, design, visualizations, interactive, novel",,2,8,10,7,5,1,4,3,9,6,205
"TITLE: Dis-function: Learning distance functions interactively WORDS: new, space, large, novel, users, use, design, visualizations, interactive, volume",Dis-function: Learning distance functions interactively,5,6,7,1,10,8,9,2,4,3,206
"TITLE: LeadLine: Interactive visual analysis of text data through event identification and exploration WORDS: users, use, design, visualizations, interactive, used, new, space, large, different",LeadLine: Interactive visual analysis of text data through event identification and exploration,8,7,10,2,6,3,4,1,9,5,207
"TITLE: Relative N-gram signatures: Document visualization at the level of character N-grams WORDS: new, users, use, design, visualizations, interactive, novel, different, study, technique",Relative N-gram signatures: Document visualization at the level of character N-grams,5,8,4,7,10,1,2,6,9,3,208
"TITLE: The Deshredder: A visual analytic approach to reconstructing shredded documents WORDS: used, new, users, use, design, visualizations, interactive, space, large, volume",The Deshredder: A visual analytic approach to reconstructing shredded documents,8,4,2,9,7,5,10,3,6,1,209
"TITLE:  WORDS: new, used, users, use, design, visualizations, interactive, volume, novel, space",,6,5,10,2,8,3,7,1,9,4,210
"TITLE: SocialNetSense: Supporting sensemaking of social and structural features in networks with interactive visualization WORDS: new, users, use, design, visualizations, interactive, space, large, novel, flow",SocialNetSense: Supporting sensemaking of social and structural features in networks with interactive visualization,1,6,5,10,7,4,9,2,8,3,211
"TITLE: Spatiotemporal social media analytics for abnormal event detection and examination using seasonal-trend decomposition WORDS: new, novel, users, use, design, visualizations, interactive, flow, tasks, volume",Spatiotemporal social media analytics for abnormal event detection and examination using seasonal-trend decomposition,1,2,5,6,3,8,9,4,10,7,212
"TITLE: AlVis: Situation awareness in the surveillance of road tunnels WORDS: users, use, design, visualizations, interactive, different, study, technique, time, method",AlVis: Situation awareness in the surveillance of road tunnels,3,2,5,9,6,10,7,8,4,1,213
"TITLE: Smart super views---A knowledge-assisted interface for medical visualization WORDS: users, use, design, visualizations, interactive, volume, new, different, study, technique",Smart super views---A knowledge-assisted interface for medical visualization,6,2,10,3,4,1,5,9,7,8,214
"TITLE: Visual analytics for the big data era---A comparative review of state-of-the-art commercial systems WORDS: users, use, design, visualizations, interactive, flow, tasks, new, used, different",Visual analytics for the big data era---A comparative review of state-of-the-art commercial systems,7,1,10,5,9,3,8,4,2,6,215
"TITLE: Visual analytics methods for categoric spatio-temporal data WORDS: users, use, design, visualizations, interactive, new, different, study, technique, time",Visual analytics methods for categoric spatio-temporal data,10,3,4,5,9,1,2,8,7,6,216
"TITLE: Watch this: A taxonomy for dynamic data visualization WORDS: new, users, use, design, visualizations, interactive, used, novel, different, study",Watch this: A taxonomy for dynamic data visualization,4,3,7,9,1,2,10,8,5,6,217
"TITLE: Information retrieval failure analysis: Visual analytics as a support for interactive &#x201C;what-if&#x201D; investigation WORDS: used, users, use, design, visualizations, interactive, new, space, large, volume",Information retrieval failure analysis: Visual analytics as a support for interactive &#x201C;what-if&#x201D; investigation,6,7,8,4,1,9,5,2,10,3,218
"TITLE: A visual analytics approach to understanding cycling behaviour WORDS: users, use, design, visualizations, interactive, new, different, study, technique, time",A visual analytics approach to understanding cycling behaviour,1,3,6,4,5,2,10,7,8,9,219
"TITLE: Matrix-based visual correlation analysis on large timeseries data WORDS: new, users, use, design, visualizations, interactive, novel, volume, different, study",Matrix-based visual correlation analysis on large timeseries data,2,9,10,6,8,3,7,5,4,1,220
"TITLE: Feature-similarity visualization of MRI cortical surface data WORDS: users, use, design, visualizations, interactive, used, different, study, technique, time",Feature-similarity visualization of MRI cortical surface data,9,3,5,10,2,1,6,8,4,7,221
"TITLE: Augmenting visual representation of affectively charged information using sound graphs WORDS: users, use, design, visualizations, interactive, volume, different, study, technique, time",Augmenting visual representation of affectively charged information using sound graphs,4,1,5,8,7,2,9,6,10,3,222
"TITLE: Time-oriented visualization and anticipation WORDS: new, users, use, design, visualizations, interactive, space, large, flow, tasks",Time-oriented visualization and anticipation,8,9,3,4,1,5,2,10,6,7,223
"TITLE: Visualising variations in household energy consumption WORDS: users, use, design, visualizations, interactive, space, large, flow, tasks, different",Visualising variations in household energy consumption,9,2,3,5,7,6,8,4,10,1,224
"TITLE: Optimizing an SPT-tree for visual analytics WORDS: new, users, use, design, visualizations, interactive, space, large, volume, used",Optimizing an SPT-tree for visual analytics,10,5,8,7,2,1,6,4,9,3,225
"TITLE: Using translational science in visual analytics WORDS: users, use, design, visualizations, interactive, different, study, technique, time, method",Using translational science in visual analytics,2,7,8,9,10,5,6,4,3,1,226
"TITLE: Incorporating GOMS analysis into the design of an EEG data visual analysis tool WORDS: volume, used, new, users, use, design, visualizations, interactive, space, large",Incorporating GOMS analysis into the design of an EEG data visual analysis tool,1,5,2,9,7,10,4,3,8,6,227
"TITLE: Exploring cyber physical data streams using Radial Pixel Visualizations WORDS: new, users, use, design, visualizations, interactive, volume, flow, tasks, novel",Exploring cyber physical data streams using Radial Pixel Visualizations,1,2,3,8,9,4,7,6,10,5,228
"TITLE: Exploring the impact of emotion on visual judgement WORDS: used, space, large, users, use, design, visualizations, interactive, new, different",Exploring the impact of emotion on visual judgement,8,1,9,3,4,7,10,5,6,2,229
"TITLE: Visualizing flows of images in social media WORDS: new, users, use, design, visualizations, interactive, space, large, novel, flow",Visualizing flows of images in social media,3,8,4,7,9,5,10,1,2,6,230
"TITLE: Using visual analytics to detect problems in datasets collected from photo-sharing services WORDS: new, users, use, design, visualizations, interactive, space, large, novel, different",Using visual analytics to detect problems in datasets collected from photo-sharing services,9,3,7,4,1,6,5,10,2,8,231
"TITLE: A generic model for the integration of interactive visualization and statistical computing using R WORDS: used, new, space, large, novel, users, use, design, visualizations, interactive",A generic model for the integration of interactive visualization and statistical computing using R,4,1,8,5,6,3,10,7,9,2,232
"TITLE: The spatiotemporal multivariate hypercube for discovery of patterns in event data WORDS: new, users, use, design, visualizations, interactive, flow, tasks, novel, volume",The spatiotemporal multivariate hypercube for discovery of patterns in event data,5,9,2,7,6,3,10,4,8,1,233
"TITLE: Priming Locus of Control to affect performance WORDS: space, large, new, users, use, design, visualizations, interactive, flow, tasks",Priming Locus of Control to affect performance,2,1,8,6,10,5,9,7,4,3,234
"TITLE: Visual exploration of local interest points in sets of time series WORDS: users, use, design, visualizations, interactive, volume, different, study, technique, time",Visual exploration of local interest points in sets of time series,2,1,5,4,10,9,7,6,8,3,235
"TITLE: Infographics at the Congressional Budget Office WORDS: used, new, volume, users, use, design, visualizations, interactive, novel, flow",Infographics at the Congressional Budget Office,9,3,5,8,1,7,6,2,10,4,236
"TITLE: A case study: Tracking and visualizing the evolution of dark matter halos and groups of satellite halos in cosmology simulations WORDS: users, use, design, visualizations, interactive, different, study, technique, time, method",A case study: Tracking and visualizing the evolution of dark matter halos and groups of satellite halos in cosmology simulations,7,2,6,9,3,1,4,5,10,8,237
"TITLE: VDQAM: A toolkit for database quality evaluation based on visual morphology WORDS: new, users, use, design, visualizations, interactive, used, volume, novel, space",VDQAM: A toolkit for database quality evaluation based on visual morphology,6,5,7,8,4,9,3,2,10,1,238
"TITLE: LensingWikipedia: Parsing text for the interactive visualization of human history WORDS: users, use, design, visualizations, interactive, new, used, volume, different, study",LensingWikipedia: Parsing text for the interactive visualization of human history,4,3,6,5,2,7,8,1,9,10,239
"TITLE: Saliency-Assisted Navigation of Very Large Landscape Images WORDS: new, novel, volume, users, use, design, visualizations, interactive, space, large",Saliency-Assisted Navigation of Very Large Landscape Images,1,3,9,2,7,10,4,5,8,6,240
"TITLE: Hierarchical Event Selection for Video Storyboards with a Case Study on Snooker Video Visualization WORDS: users, use, design, visualizations, interactive, volume, new, different, study, technique",Hierarchical Event Selection for Video Storyboards with a Case Study on Snooker Video Visualization,5,9,7,2,6,3,8,1,4,10,241
"TITLE: Artificial Defocus for Displaying Markers in Microscopy Z-Stacks WORDS: users, use, design, visualizations, interactive, different, study, technique, time, method",Artificial Defocus for Displaying Markers in Microscopy Z-Stacks,3,8,10,4,6,1,2,5,7,9,242
"TITLE: Visualization of Topological Structures in Area-Preserving Maps WORDS: users, use, design, visualizations, interactive, used, different, study, technique, time",Visualization of Topological Structures in Area-Preserving Maps,4,1,10,6,5,8,9,2,7,3,243
"TITLE: Multi-Touch Table System for Medical Visualization: Application to Orthopedic Surgery Planning WORDS: used, users, use, design, visualizations, interactive, space, large, new, volume",Multi-Touch Table System for Medical Visualization: Application to Orthopedic Surgery Planning,2,4,7,8,9,5,1,10,6,3,244
"TITLE: Load-Balanced Parallel Streamline Generation on Large Scale Vector fields WORDS: new, users, use, design, visualizations, interactive, used, space, large, novel",Load-Balanced Parallel Streamline Generation on Large Scale Vector fields,8,1,5,10,6,4,7,2,9,3,245
"TITLE: Extinction-Based Shading and Illumination in GPU Volume Ray-Casting WORDS: flow, tasks, users, use, design, visualizations, interactive, volume, space, large",Extinction-Based Shading and Illumination in GPU Volume Ray-Casting,5,3,4,7,6,2,9,1,8,10,246
"TITLE: GPU-Based Interactive Cut-Surface Extraction From High-Order finite Element fields WORDS: new, novel, users, use, design, visualizations, interactive, space, large, used",GPU-Based Interactive Cut-Surface Extraction From High-Order finite Element fields,1,2,7,6,8,3,10,9,5,4,247
"TITLE: GPU-based Real-Time Approximation of the Ablation Zone for Radiofrequency Ablation WORDS: users, use, design, visualizations, interactive, new, space, large, different, study",GPU-based Real-Time Approximation of the Ablation Zone for Radiofrequency Ablation,2,5,4,10,9,6,8,1,3,7,248
"TITLE: Feature-Based Statistical Analysis of Combustion Simulation Data WORDS: users, use, design, visualizations, interactive, new, used, different, study, technique",Feature-Based Statistical Analysis of Combustion Simulation Data,7,5,2,6,9,1,4,8,3,10,249
"TITLE: Quasi Interpolation With Voronoi Splines WORDS: users, use, design, visualizations, interactive, new, volume, flow, tasks, different",Quasi Interpolation With Voronoi Splines,8,3,7,1,2,9,5,6,4,10,250
"TITLE: Topological Spines: A Structure-preserving Visual Representation of Scalar fields WORDS: users, use, design, visualizations, interactive, new, used, different, study, technique",Topological Spines: A Structure-preserving Visual Representation of Scalar fields,6,1,9,8,10,2,7,5,4,3,251
"TITLE: Towards Robust Topology of Sparsely Sampled Data WORDS: users, use, design, visualizations, interactive, space, large, new, volume, different",Towards Robust Topology of Sparsely Sampled Data,3,4,8,5,10,2,6,1,9,7,252
"TITLE: Visualization of AMR Data With Multi-Level Dual-Mesh Interpolation WORDS: volume, used, space, large, users, use, design, visualizations, interactive, new",Visualization of AMR Data With Multi-Level Dual-Mesh Interpolation,6,2,5,4,9,3,8,1,10,7,253
"TITLE: Nodes on Ropes: A Comprehensive Data and Control Flow for Steering Ensemble Simulations WORDS: new, space, large, flow, tasks, users, use, design, visualizations, interactive",Nodes on Ropes: A Comprehensive Data and Control Flow for Steering Ensemble Simulations,8,5,3,7,4,1,9,2,10,6,254
"TITLE:  WORDS: users, use, design, visualizations, interactive, new, volume, different, study, technique",,4,10,6,3,5,2,1,9,7,8,255
"TITLE: Tuner: Principled Parameter finding for Image Segmentation Algorithms Using Visual Response Surface Exploration WORDS: space, large, used, new, users, use, design, visualizations, interactive, novel",Tuner: Principled Parameter finding for Image Segmentation Algorithms Using Visual Response Surface Exploration,1,5,10,4,7,6,9,3,8,2,256
"TITLE: Branching and Circular Features in High Dimensional Data WORDS: users, use, design, visualizations, interactive, used, new, flow, tasks, different",Branching and Circular Features in High Dimensional Data,8,3,7,9,6,4,10,5,2,1,257
"TITLE: Features in Continuous Parallel Coordinates WORDS: used, users, use, design, visualizations, interactive, flow, tasks, new, volume",Features in Continuous Parallel Coordinates,1,3,7,2,4,8,10,9,6,5,258
"TITLE: About the Influence of Illumination Models on Image Comprehension in Direct Volume Rendering WORDS: flow, tasks, space, large, users, use, design, visualizations, interactive, used",About the Influence of Illumination Models on Image Comprehension in Direct Volume Rendering,1,4,6,8,9,7,3,2,10,5,259
"TITLE: Automatic Transfer Functions Based on Informational Divergence WORDS: users, use, design, visualizations, interactive, used, space, large, flow, tasks",Automatic Transfer Functions Based on Informational Divergence,1,3,6,5,8,4,7,10,9,2,260
"TITLE: The Effect of Colour and Transparency on the Perception of Overlaid Grids WORDS: new, users, use, design, visualizations, interactive, novel, flow, tasks, used",The Effect of Colour and Transparency on the Perception of Overlaid Grids,8,10,7,9,3,1,5,6,2,4,261
"TITLE: Flow Radar Glyphs&amp;#8212;Static Visualization of Unsteady Flow with Uncertainty WORDS: used, flow, tasks, users, use, design, visualizations, interactive, space, large",Flow Radar Glyphs&amp;#8212;Static Visualization of Unsteady Flow with Uncertainty,8,7,10,9,5,6,4,2,1,3,262
"TITLE: iView: A Feature Clustering Framework for Suggesting Informative Views in Volume Visualization WORDS: flow, tasks, new, users, use, design, visualizations, interactive, used, volume",iView: A Feature Clustering Framework for Suggesting Informative Views in Volume Visualization,5,9,4,6,8,1,7,2,10,3,263
"TITLE: Volume Analysis Using Multimodal Surface Similarity WORDS: users, use, design, visualizations, interactive, new, used, different, study, technique",Volume Analysis Using Multimodal Surface Similarity,2,7,10,4,9,6,5,3,1,8,264
"TITLE: Asymmetric Tensor field Visualization for Surfaces WORDS: new, users, use, design, visualizations, interactive, used, novel, space, large",Asymmetric Tensor field Visualization for Surfaces,7,3,10,8,9,1,6,2,4,5,265
"TITLE: An Interactive Local Flattening Operator to Support Digital Investigations on Artwork Surfaces WORDS: new, users, use, design, visualizations, interactive, used, volume, novel, different",An Interactive Local Flattening Operator to Support Digital Investigations on Artwork Surfaces,8,5,6,3,4,2,9,10,7,1,266
"TITLE: Context Preserving Maps of Tubular Structures WORDS: users, use, design, visualizations, interactive, flow, tasks, different, study, technique",Context Preserving Maps of Tubular Structures,9,7,5,4,3,2,10,6,8,1,267
"TITLE: Authalic Parameterization of General Surfaces Using Lie Advection WORDS: new, users, use, design, visualizations, interactive, flow, tasks, volume, space",Authalic Parameterization of General Surfaces Using Lie Advection,5,7,8,10,6,3,1,4,9,2,268
"TITLE: TransGraph: Hierarchical Exploration of Transition Relationships in Time-Varying Volumetric Data WORDS: users, use, design, visualizations, interactive, different, study, technique, time, method",TransGraph: Hierarchical Exploration of Transition Relationships in Time-Varying Volumetric Data,5,3,8,2,9,6,10,1,7,4,269
"TITLE: Voronoi-Based Extraction and Visualization of Molecular Paths WORDS: volume, users, use, design, visualizations, interactive, new, used, flow, tasks",Voronoi-Based Extraction and Visualization of Molecular Paths,1,9,6,5,4,2,7,8,3,10,270
"TITLE: Symmetry in Scalar field Topology WORDS: new, users, use, design, visualizations, interactive, used, novel, different, study",Symmetry in Scalar field Topology,2,1,6,3,7,8,9,4,5,10,271
"TITLE: A Scale Space Based Persistence Measure for Critical Points in 2D Scalar fields WORDS: flow, tasks, users, use, design, visualizations, interactive, volume, different, study",A Scale Space Based Persistence Measure for Critical Points in 2D Scalar fields,9,1,7,10,2,4,8,6,3,5,272
"TITLE: Evaluation of Trend Localization with Multi-Variate Visualizations WORDS: new, novel, users, use, design, visualizations, interactive, used, space, large",Evaluation of Trend Localization with Multi-Variate Visualizations,4,1,10,6,9,8,7,3,5,2,273
"TITLE: Straightening Tubular Flow for Side-by-Side Visualization WORDS: users, use, design, visualizations, interactive, new, volume, flow, tasks, used",Straightening Tubular Flow for Side-by-Side Visualization,3,1,7,10,5,6,9,2,4,8,274
"TITLE: Vortex Visualization in Ultra Low Reynolds Number Insect Flight WORDS: users, use, design, visualizations, interactive, volume, used, different, study, technique",Vortex Visualization in Ultra Low Reynolds Number Insect Flight,9,1,4,7,3,2,10,5,8,6,275
"TITLE: Two-Dimensional Time-Dependent Vortex Regions Based on the Acceleration Magnitude WORDS: new, users, use, design, visualizations, interactive, novel, used, different, study",Two-Dimensional Time-Dependent Vortex Regions Based on the Acceleration Magnitude,2,6,5,9,10,3,1,7,4,8,276
"TITLE: Adaptive Extraction and Quantification of Geophysical Vortices WORDS: volume, users, use, design, visualizations, interactive, new, used, space, large",Adaptive Extraction and Quantification of Geophysical Vortices,3,7,6,10,1,4,9,2,5,8,277
"TITLE: FoamVis: Visualization of 2D Foam Simulation Data WORDS: users, use, design, visualizations, interactive, used, different, study, technique, time",FoamVis: Visualization of 2D Foam Simulation Data,9,5,4,3,8,10,6,1,2,7,278
"TITLE: WYSIWYG (What You See is What You Get) Volume Visualization WORDS: users, use, design, visualizations, interactive, different, study, technique, time, method",WYSIWYG (What You See is What You Get) Volume Visualization,5,7,10,9,8,3,4,1,6,2,279
"TITLE: Interactive Volume Visualization of General Polyhedral Grids WORDS: users, use, design, visualizations, interactive, space, large, used, volume, new",Interactive Volume Visualization of General Polyhedral Grids,4,1,7,8,5,6,3,10,2,9,280
"TITLE: Image Plane Sweep Volume Illumination WORDS: users, use, design, visualizations, interactive, space, large, flow, tasks, used",Image Plane Sweep Volume Illumination,4,3,2,5,6,7,10,8,1,9,281
"TITLE: Interactive Multiscale Tensor Reconstruction for Multiresolution Volume Visualization WORDS: new, volume, users, use, design, visualizations, interactive, novel, space, large",Interactive Multiscale Tensor Reconstruction for Multiresolution Volume Visualization,2,8,3,6,4,1,7,5,10,9,282
"TITLE: An Efficient Direct Volume Rendering Approach for Dichromats WORDS: users, use, design, visualizations, interactive, used, different, study, technique, time",An Efficient Direct Volume Rendering Approach for Dichromats,2,4,3,10,7,6,1,5,8,9,283
"TITLE: Interactive Virtual Probing of 4D MRI Blood-Flow WORDS: new, users, use, design, visualizations, interactive, space, large, flow, tasks",Interactive Virtual Probing of 4D MRI Blood-Flow,1,10,2,4,7,9,8,6,3,5,284
"TITLE: Crepuscular Rays for Tumor Accessibility Planning WORDS: users, use, design, visualizations, interactive, space, large, different, study, technique",Crepuscular Rays for Tumor Accessibility Planning,9,2,3,6,5,1,4,10,8,7,285
"TITLE: Distance Visualization for Interactive 3D Implant Planning WORDS: used, new, space, large, users, use, design, visualizations, interactive, flow",Distance Visualization for Interactive 3D Implant Planning,2,1,3,10,4,7,6,5,9,8,286
"TITLE: The FLOWLENS: A Focus-and-Context Visualization Approach for Exploration of Blood Flow in Cerebral Aneurysms WORDS: used, new, users, use, design, visualizations, interactive, volume, novel, space",The FLOWLENS: A Focus-and-Context Visualization Approach for Exploration of Blood Flow in Cerebral Aneurysms,4,10,5,3,2,1,7,9,6,8,287
"TITLE: Projection-Based Metal-Artifact Reduction for Industrial 3D X-ray Computed Tomography WORDS: users, use, design, visualizations, interactive, used, new, flow, tasks, different",Projection-Based Metal-Artifact Reduction for Industrial 3D X-ray Computed Tomography,1,2,4,3,5,7,8,9,10,6,288
"TITLE: Quality Metrics in High-Dimensional Data Visualization: An Overview and Systematization WORDS: users, use, design, visualizations, interactive, new, different, study, technique, time",Quality Metrics in High-Dimensional Data Visualization: An Overview and Systematization,8,3,10,9,7,1,6,2,5,4,289
"TITLE: Benefitting InfoVis with Visual Difficulties WORDS: new, users, use, design, visualizations, interactive, novel, used, volume, different",Benefitting InfoVis with Visual Difficulties,9,1,5,7,6,3,10,4,2,8,290
