"TITLE: Product Plots WORDS: new, users, use, design, visualizations, interactive, used, volume, novel, different",Product Plots,2,7,5,3,10,6,9,4,1,8,291
"TITLE: Visualization Rhetoric: Framing Effects in Narrative Visualization WORDS: new, space, large, novel, volume, used, flow, tasks, users, use",Visualization Rhetoric: Framing Effects in Narrative Visualization,1,4,10,6,5,3,7,2,9,8,292
"TITLE: Adaptive Privacy-Preserving Visualization Using Parallel Coordinates WORDS: users, use, design, visualizations, interactive, new, different, study, technique, time",Adaptive Privacy-Preserving Visualization Using Parallel Coordinates,3,9,1,5,7,2,10,6,8,4,293
"TITLE: Context-Preserving Visual Links WORDS: users, use, design, visualizations, interactive, new, used, different, study, technique",Context-Preserving Visual Links,10,2,1,3,9,6,8,4,7,5,294
"TITLE:  WORDS: new, novel, users, use, design, visualizations, interactive, space, large, used",,6,1,10,8,4,3,7,5,9,2,295
"TITLE: Developing and Evaluating Quilts for the Depiction of Large Layered Graphs WORDS: users, use, design, visualizations, interactive, used, new, different, study, technique",Developing and Evaluating Quilts for the Depiction of Large Layered Graphs,2,3,8,7,9,1,4,5,10,6,296
"TITLE: Arc Length-Based Aspect Ratio Selection WORDS: users, use, design, visualizations, interactive, used, new, flow, tasks, different",Arc Length-Based Aspect Ratio Selection,9,1,6,2,4,5,7,3,8,10,297
"TITLE: Asymmetric Relations in Longitudinal Social Networks WORDS: new, users, use, design, visualizations, interactive, used, space, large, novel",Asymmetric Relations in Longitudinal Social Networks,4,3,10,5,6,1,7,2,9,8,298
"TITLE:  WORDS: users, use, design, visualizations, interactive, new, space, large, different, study",,10,2,7,1,3,6,9,8,4,5,299
"TITLE: D&#x0B3; Data-Driven Documents WORDS: new, used, flow, tasks, users, use, design, visualizations, interactive, volume",D&#x0B3; Data-Driven Documents,7,1,9,2,4,3,5,6,10,8,300
"TITLE: Flexible Linked Axes for Multivariate Data Visualization WORDS: users, use, design, visualizations, interactive, new, space, large, different, study",Flexible Linked Axes for Multivariate Data Visualization,6,7,1,10,3,5,4,8,9,2,301
"TITLE: Synthetic Generation of High-Dimensional Datasets WORDS: new, users, use, design, visualizations, interactive, novel, different, study, technique",Synthetic Generation of High-Dimensional Datasets,6,1,8,2,3,5,10,4,7,9,302
"TITLE: Stereoscopic Highlighting: 2D Graph Visualization on Stereo Displays WORDS: used, space, large, new, users, use, design, visualizations, interactive, novel",Stereoscopic Highlighting: 2D Graph Visualization on Stereo Displays,2,3,4,8,1,5,9,6,7,10,303
"TITLE: In Situ Exploration of Large Dynamic Networks WORDS: users, use, design, visualizations, interactive, new, space, large, different, study",In Situ Exploration of Large Dynamic Networks,6,3,10,7,9,5,8,2,4,1,304
"TITLE: Parallel Edge Splatting for Scalable Dynamic Graph Visualization WORDS: used, new, volume, users, use, design, visualizations, interactive, space, large",Parallel Edge Splatting for Scalable Dynamic Graph Visualization,8,6,9,1,5,2,3,4,7,10,305
"TITLE: Divided Edge Bundling for Directional Network Data WORDS: space, large, volume, users, use, design, visualizations, interactive, new, used",Divided Edge Bundling for Directional Network Data,6,2,7,8,10,1,5,4,3,9,306
"TITLE: Skeleton-Based Edge Bundling for Graph Visualization WORDS: space, large, users, use, design, visualizations, interactive, used, different, study",Skeleton-Based Edge Bundling for Graph Visualization,5,1,3,6,4,2,9,7,10,8,307
"TITLE: BirdVis: Visualizing and Understanding Bird Populations WORDS: users, use, design, visualizations, interactive, new, space, large, different, study",BirdVis: Visualizing and Understanding Bird Populations,3,6,4,9,1,8,10,5,7,2,308
"TITLE: BallotMaps: Detecting Name Bias in Alphabetically Ordered Ballot Papers WORDS: users, use, design, visualizations, interactive, new, space, large, different, study",BallotMaps: Detecting Name Bias in Alphabetically Ordered Ballot Papers,2,1,3,4,9,8,10,5,7,6,309
"TITLE: Sequence Surveyor: Leveraging Overview for Scalable Genomic Alignment Visualization WORDS: users, use, design, visualizations, interactive, different, study, technique, time, method",Sequence Surveyor: Leveraging Overview for Scalable Genomic Alignment Visualization,2,8,10,3,9,4,7,5,6,1,310
"TITLE: Visualization of Parameter Space for Image Analysis WORDS: users, use, design, visualizations, interactive, new, used, flow, tasks, different",Visualization of Parameter Space for Image Analysis,5,6,10,3,4,1,8,2,9,7,311
"TITLE: TextFlow: Towards Better Understanding of Evolving Topics in Text WORDS: used, new, users, use, design, visualizations, interactive, volume, novel, space",TextFlow: Towards Better Understanding of Evolving Topics in Text,6,1,3,7,5,9,4,10,2,8,312
"TITLE: Exploratory Analysis of Time-Series with ChronoLenses WORDS: used, users, use, design, visualizations, interactive, different, study, technique, time",Exploratory Analysis of Time-Series with ChronoLenses,1,7,9,5,8,2,3,10,6,4,313
"TITLE: CloudLines: Compact Display of Event Episodes in Multiple Time-Series WORDS: users, use, design, visualizations, interactive, new, used, different, study, technique",CloudLines: Compact Display of Event Episodes in Multiple Time-Series,3,4,10,2,5,6,9,7,8,1,314
"TITLE:  WORDS: new, users, use, design, visualizations, interactive, volume, used, novel, different",,2,4,7,1,5,3,9,10,8,6,315
"TITLE: TreeNetViz: Revealing Patterns of Networks over Tree Structures WORDS: users, use, design, visualizations, interactive, new, different, study, technique, time",TreeNetViz: Revealing Patterns of Networks over Tree Structures,3,7,4,10,8,5,1,6,2,9,316
"TITLE: Improved Similarity Trees and their Application to Visual Data Classification WORDS: new, used, novel, users, use, design, visualizations, interactive, space, large",Improved Similarity Trees and their Application to Visual Data Classification,6,4,10,5,9,3,2,8,1,7,317
"TITLE: A Study on Dual-Scale Data Charts WORDS: new, novel, users, use, design, visualizations, interactive, used, space, large",A Study on Dual-Scale Data Charts,3,1,9,7,10,5,4,2,6,8,318
"TITLE: Evaluation of Artery Visualizations for Heart Disease Diagnosis WORDS: users, use, design, visualizations, interactive, different, study, technique, time, method",Evaluation of Artery Visualizations for Heart Disease Diagnosis,1,2,7,3,5,4,10,6,8,9,319
"TITLE: Exploring Ambient and Artistic Visualization for Residential Energy Use Feedback WORDS: users, use, design, visualizations, interactive, different, study, technique, time, method",Exploring Ambient and Artistic Visualization for Residential Energy Use Feedback,8,3,2,10,6,1,5,7,9,4,320
"TITLE: Human-Centered Approaches in Geovisualization Design: Investigating Multiple Methods Through a Long-Term Case Study WORDS: space, large, users, use, design, visualizations, interactive, used, different, study",Human-Centered Approaches in Geovisualization Design: Investigating Multiple Methods Through a Long-Term Case Study,5,10,1,3,8,4,6,9,7,2,321
"TITLE: Visual Thinking In Action: Visualizations As Used On Whiteboards WORDS: used, users, use, design, visualizations, interactive, new, space, large, different",Visual Thinking In Action: Visualizations As Used On Whiteboards,4,3,7,8,2,6,9,5,10,1,322
