name,group,T1,T2,T3,T4,T5,T6,T7,T8,T9,T10,ID
"TITLE: A Partition-Based Framework for Building and Validating Regression Models WORDS: users, use, design, visualizations, interactive, volume, different, study, technique, time",A Partition-Based Framework for Building and Validating Regression Models,9,8,6,7,2,3,4,1,5,10,1
"TITLE: Decision Exploration Lab: A Visual Analytics Solution for Decision Management WORDS: new, novel, used, space, large, users, use, design, visualizations, interactive",Decision Exploration Lab: A Visual Analytics Solution for Decision Management,2,1,6,5,7,3,9,8,10,4,2
"TITLE: Vis4Heritage: Visual Analytics Approach on Grotto Wall Painting Degradations WORDS: space, large, used, new, novel, flow, tasks, users, use, design",Vis4Heritage: Visual Analytics Approach on Grotto Wall Painting Degradations,3,9,2,5,7,8,1,10,6,4,3
"TITLE: UTOPIAN: User-Driven Topic Modeling Based on Interactive Nonnegative Matrix Factorization WORDS: users, use, design, visualizations, interactive, new, different, study, technique, time",UTOPIAN: User-Driven Topic Modeling Based on Interactive Nonnegative Matrix Factorization,6,10,4,5,8,2,3,1,7,9,4
"TITLE: HierarchicalTopics: Visually Exploring Large Text Collections Using Topic Hierarchies WORDS: space, large, new, users, use, design, visualizations, interactive, volume, novel",HierarchicalTopics: Visually Exploring Large Text Collections Using Topic Hierarchies,4,10,8,6,9,3,2,7,1,5,5
"TITLE: Visual Analysis of Topic Competition on Social Media WORDS: new, users, use, design, visualizations, interactive, novel, different, study, technique",Visual Analysis of Topic Competition on Social Media,4,7,6,1,2,9,5,10,3,8,6
"TITLE: ScatterBlogs2: Real-Time Monitoring of Microblog Messages through User-Guided filtering WORDS: users, use, design, visualizations, interactive, new, used, volume, different, study",ScatterBlogs2: Real-Time Monitoring of Microblog Messages through User-Guided filtering,3,4,6,7,9,8,2,10,5,1,7
"TITLE: Visual Analytics for Multimodal Social Network Analysis: A Design Study with Social Scientists WORDS: users, use, design, visualizations, interactive, new, flow, tasks, different, study",Visual Analytics for Multimodal Social Network Analysis: A Design Study with Social Scientists,5,1,6,3,10,8,7,4,2,9,8
"TITLE: Explainers: Expert Explorations with Crafted Projections WORDS: new, users, use, design, visualizations, interactive, used, novel, different, study",Explainers: Expert Explorations with Crafted Projections,1,3,9,7,4,10,6,8,5,2,9
"TITLE: Semantics of Directly Manipulating Spatializations WORDS: used, volume, users, use, design, visualizations, interactive, new, different, study",Semantics of Directly Manipulating Spatializations,3,10,2,6,5,7,9,4,8,1,10
"TITLE: SketchPadN-D: WYDIWYG Sculpting and Editing in High-Dimensional Space WORDS: users, use, design, visualizations, interactive, different, study, technique, time, method",SketchPadN-D: WYDIWYG Sculpting and Editing in High-Dimensional Space,4,5,6,2,8,10,3,1,9,7,11
"TITLE: Visual Analysis of Higher-Order Conjunctive Relationships in Multidimensional Data Using a Hypergraph Query System WORDS: users, use, design, visualizations, interactive, volume, flow, tasks, new, different",Visual Analysis of Higher-Order Conjunctive Relationships in Multidimensional Data Using a Hypergraph Query System,4,1,7,5,8,6,9,10,3,2,12
"TITLE: Interactive Exploration of Implicit and Explicit Relations in Faceted Datasets WORDS: used, volume, new, flow, tasks, space, large, users, use, design",Interactive Exploration of Implicit and Explicit Relations in Faceted Datasets,2,5,8,10,9,6,1,7,3,4,13
"TITLE: VAICo: Visual Analysis for Image Comparison WORDS: users, use, design, visualizations, interactive, different, study, technique, time, method",VAICo: Visual Analysis for Image Comparison,3,5,4,6,9,8,7,2,10,1,14
"TITLE: Open-Box Spectral Clustering: Applications to Medical Image Analysis WORDS: users, use, design, visualizations, interactive, space, large, used, volume, different",Open-Box Spectral Clustering: Applications to Medical Image Analysis,5,3,4,2,8,1,6,7,10,9,15
"TITLE: Transformation of an Uncertain Video Search Pipeline to a Sketch-Based Visual Analytics Loop WORDS: space, large, users, use, design, visualizations, interactive, flow, tasks, new",Transformation of an Uncertain Video Search Pipeline to a Sketch-Based Visual Analytics Loop,5,9,7,4,3,8,2,10,1,6,16
"TITLE: Interactive Exploration of Surveillance Video through Action Shot Summarization and Trajectory Visualization WORDS: users, use, design, visualizations, interactive, new, volume, used, different, study",Interactive Exploration of Surveillance Video through Action Shot Summarization and Trajectory Visualization,10,1,3,7,4,5,9,8,2,6,17
"TITLE: Space-Time Visual Analytics of Eye-Tracking Data for Dynamic Stimuli WORDS: users, use, design, visualizations, interactive, volume, space, large, flow, tasks",Space-Time Visual Analytics of Eye-Tracking Data for Dynamic Stimuli,9,4,3,5,6,1,10,2,7,8,18
"TITLE: An Extensible Framework for Provenance in Human Terrain Visual Analytics WORDS: users, use, design, visualizations, interactive, different, study, technique, time, method",An Extensible Framework for Provenance in Human Terrain Visual Analytics,1,4,7,6,5,2,8,9,10,3,19
"TITLE: Visual Exploration of Big Spatio-Temporal Urban Data: A Study of New York City Taxi Trips WORDS: users, use, design, visualizations, interactive, new, used, different, study, technique",Visual Exploration of Big Spatio-Temporal Urban Data: A Study of New York City Taxi Trips,1,2,5,3,4,6,8,7,9,10,20
"TITLE: Visual Traffic Jam Analysis Based on Trajectory Data WORDS: new, users, use, design, visualizations, interactive, novel, space, large, different",Visual Traffic Jam Analysis Based on Trajectory Data,5,4,7,8,6,9,1,3,10,2,21
"TITLE: Space Transformation for Understanding Group Movement WORDS: users, use, design, visualizations, interactive, new, different, study, technique, time",Space Transformation for Understanding Group Movement,1,2,5,7,9,6,4,3,8,10,22
"TITLE: Visual Analytics for Spatial Clustering: Using a Heuristic Approach for Guided Exploration WORDS: new, novel, users, use, design, visualizations, interactive, space, large, volume",Visual Analytics for Spatial Clustering: Using a Heuristic Approach for Guided Exploration,4,2,7,6,3,1,10,9,8,5,23
"TITLE: Supporting Awareness through Collaborative Brushing and Linking of Tabular Data WORDS: users, use, design, visualizations, interactive, volume, different, study, technique, time",Supporting Awareness through Collaborative Brushing and Linking of Tabular Data,1,6,9,7,5,2,10,3,8,4,24
"TITLE: Identifying Redundancy and Exposing Provenance in Crowdsourced Data Analysis WORDS: users, use, design, visualizations, interactive, new, different, study, technique, time",Identifying Redundancy and Exposing Provenance in Crowdsourced Data Analysis,3,1,9,7,4,5,10,8,6,2,25
"TITLE: The Impact of Physical Navigation on Spatial Organization for Sensemaking WORDS: users, use, design, visualizations, interactive, new, different, study, technique, time",The Impact of Physical Navigation on Spatial Organization for Sensemaking,3,9,7,1,5,2,4,8,10,6,26
"TITLE: Using Interactive Visual Reasoning to Support Sense-Making: Implications for Design WORDS: new, users, use, design, visualizations, interactive, novel, volume, used, space",Using Interactive Visual Reasoning to Support Sense-Making: Implications for Design,10,8,3,4,2,7,6,5,1,9,27
"TITLE: Temporal Event Sequence Simplification WORDS: new, users, use, design, visualizations, interactive, novel, space, large, different",Temporal Event Sequence Simplification,1,2,9,5,6,3,10,8,7,4,28
"TITLE: Visual Analytics for Model Selection in Time Series Analysis WORDS: users, use, design, visualizations, interactive, different, study, technique, time, method",Visual Analytics for Model Selection in Time Series Analysis,6,8,4,7,1,2,10,3,9,5,29
"TITLE: TimeBench: A Data Model and Software Library for Visual Analytics of Time-Oriented Data WORDS: users, use, design, visualizations, interactive, used, different, study, technique, time",TimeBench: A Data Model and Software Library for Visual Analytics of Time-Oriented Data,1,2,10,3,5,8,6,7,9,4,30
"TITLE: MotionExplorer: Exploratory Search in Human Motion Capture Data Based on Hierarchical Aggregation WORDS: users, use, design, visualizations, interactive, new, used, space, large, different",MotionExplorer: Exploratory Search in Human Motion Capture Data Based on Hierarchical Aggregation,3,7,5,8,2,6,1,9,10,4,31
"TITLE: Supporting the Visual Analysis of Dynamic Networks by Clustering associated Temporal Attributes WORDS: users, use, design, visualizations, interactive, new, used, space, large, different",Supporting the Visual Analysis of Dynamic Networks by Clustering associated Temporal Attributes,9,8,7,6,3,10,2,5,1,4,32
"TITLE: LineUp: Visual Analysis of Multi-Attribute Rankings WORDS: users, use, design, visualizations, interactive, new, used, flow, tasks, space",LineUp: Visual Analysis of Multi-Attribute Rankings,5,7,8,3,1,2,6,4,10,9,33
"TITLE: A Model for Structure-Based Comparison of Many Categories in Small-Multiple Displays WORDS: new, users, use, design, visualizations, interactive, volume, used, novel, flow",A Model for Structure-Based Comparison of Many Categories in Small-Multiple Displays,9,3,10,1,8,2,6,5,4,7,34
"TITLE: Common Angle Plots as Perception-True Visualizations of Categorical Associations WORDS: users, use, design, visualizations, interactive, new, flow, tasks, used, different",Common Angle Plots as Perception-True Visualizations of Categorical Associations,2,1,10,9,4,3,7,6,8,5,35
"TITLE: What Makes a Visualization Memorable? WORDS: new, users, use, design, visualizations, interactive, novel, used, different, study",What Makes a Visualization Memorable?,8,7,10,6,3,4,2,5,9,1,36
"TITLE: Perception of Average Value in Multiclass Scatterplots WORDS: users, use, design, visualizations, interactive, different, study, technique, time, method",Perception of Average Value in Multiclass Scatterplots,7,1,2,6,9,3,4,10,8,5,37
"TITLE: Selecting the Aspect Ratio of a Scatter Plot Based on Its Delaunay Triangulation WORDS: users, use, design, visualizations, interactive, used, new, different, study, technique",Selecting the Aspect Ratio of a Scatter Plot Based on Its Delaunay Triangulation,1,2,6,9,5,7,10,4,8,3,38
"TITLE:  WORDS: used, space, large, users, use, design, visualizations, interactive, new, flow",,9,4,10,6,8,1,7,2,3,5,39
"TITLE: Hybrid-Image Visualization for Large Viewing Environments WORDS: users, use, design, visualizations, interactive, new, space, large, different, study",Hybrid-Image Visualization for Large Viewing Environments,8,5,1,7,9,10,6,4,2,3,40
"TITLE: An Empirically-Derived Taxonomy of Interaction Primitives for Interactive Cartography and Geovisualization WORDS: new, users, use, design, visualizations, interactive, used, space, large, flow",An Empirically-Derived Taxonomy of Interaction Primitives for Interactive Cartography and Geovisualization,6,4,5,9,3,1,7,2,10,8,41
"TITLE: A Design Space of Visualization Tasks WORDS: users, use, design, visualizations, interactive, new, used, different, study, technique",A Design Space of Visualization Tasks,3,4,1,5,6,8,9,2,10,7,42
"TITLE: A Multi-Level Typology of Abstract Visualization Tasks WORDS: volume, users, use, design, visualizations, interactive, space, large, used, new",A Multi-Level Typology of Abstract Visualization Tasks,4,9,8,5,6,2,3,1,7,10,43
"TITLE: Information Visualization and Proxemics: Design Opportunities and Empirical findings WORDS: users, use, design, visualizations, interactive, space, large, used, new, different",Information Visualization and Proxemics: Design Opportunities and Empirical findings,8,4,1,9,7,5,6,2,10,3,44
"TITLE: An Interaction Model for Visualizations Beyond The Desktop WORDS: new, space, large, used, novel, volume, flow, tasks, users, use",An Interaction Model for Visualizations Beyond The Desktop,1,7,10,9,5,3,4,8,6,2,45
"TITLE: A Deeper Understanding of Sequence in Narrative Visualization WORDS: users, use, design, visualizations, interactive, volume, different, study, technique, time",A Deeper Understanding of Sequence in Narrative Visualization,1,2,4,7,5,10,9,8,6,3,46
"TITLE: SketchStory: Telling More Engaging Stories with Data through Freeform Sketching WORDS: users, use, design, visualizations, interactive, volume, flow, tasks, new, used",SketchStory: Telling More Engaging Stories with Data through Freeform Sketching,3,4,7,10,1,2,6,5,9,8,47
"TITLE: Using Concrete Scales: A Practical Framework for Effective Visual Depiction of Complex Measures WORDS: users, use, design, visualizations, interactive, new, space, large, used, different",Using Concrete Scales: A Practical Framework for Effective Visual Depiction of Complex Measures,1,3,6,2,8,7,9,5,10,4,48
"TITLE: StoryFlow: Tracking the Evolution of Stories WORDS: space, large, volume, users, use, design, visualizations, interactive, used, new",StoryFlow: Tracking the Evolution of Stories,5,9,1,6,2,4,8,3,7,10,49
"TITLE: Visual Sedimentation WORDS: new, users, use, design, visualizations, interactive, used, volume, flow, tasks",Visual Sedimentation,2,1,8,4,3,5,9,6,7,10,50
"TITLE: Nanocubes for Real-Time Exploration of Spatiotemporal Datasets WORDS: used, new, space, large, volume, users, use, design, visualizations, interactive",Nanocubes for Real-Time Exploration of Spatiotemporal Datasets,6,4,9,5,2,3,7,8,1,10,51
"TITLE: Visualizing Request-Flow Comparison to Aid Performance Diagnosis in Distributed Systems WORDS: users, use, design, visualizations, interactive, new, different, study, technique, time",Visualizing Request-Flow Comparison to Aid Performance Diagnosis in Distributed Systems,1,3,4,9,7,2,6,8,5,10,52
"TITLE: Evaluation of filesystem Provenance Visualization Tools WORDS: new, users, use, design, visualizations, interactive, used, novel, different, study",Evaluation of filesystem Provenance Visualization Tools,3,1,2,9,10,8,4,7,6,5,53
"TITLE: Visualizing Fuzzy Overlapping Communities in Networks WORDS: users, use, design, visualizations, interactive, new, different, study, technique, time",Visualizing Fuzzy Overlapping Communities in Networks,7,3,10,6,9,2,4,5,8,1,54
"TITLE: Radial Sets: Interactive Visual Analysis of Large Overlapping Sets WORDS: users, use, design, visualizations, interactive, used, space, large, different, study",Radial Sets: Interactive Visual Analysis of Large Overlapping Sets,8,7,6,2,1,5,9,3,10,4,55
"TITLE: SoccerStories: A Kick-off for Visual Soccer Analysis WORDS: new, users, use, design, visualizations, interactive, novel, space, large, different",SoccerStories: A Kick-off for Visual Soccer Analysis,3,6,10,5,1,8,4,9,2,7,56
"TITLE: Creative User-Centered Visualization Design for Energy Analysts and Modelers WORDS: used, users, use, design, visualizations, interactive, space, large, new, different",Creative User-Centered Visualization Design for Energy Analysts and Modelers,3,2,7,4,10,1,6,5,8,9,57
"TITLE: Understanding Interfirm Relationships in Business Ecosystems with Interactive Visualization WORDS: used, new, space, large, users, use, design, visualizations, interactive, volume",Understanding Interfirm Relationships in Business Ecosystems with Interactive Visualization,1,3,5,6,9,8,10,2,7,4,58
"TITLE: Entourage: Visualizing Relationships between Biological Pathways using Contextual Subsets WORDS: users, use, design, visualizations, interactive, new, different, study, technique, time",Entourage: Visualizing Relationships between Biological Pathways using Contextual Subsets,8,3,6,10,1,4,5,9,7,2,59
"TITLE: Variant View: Visualizing Sequence Variants in their Gene Context WORDS: new, users, use, design, visualizations, interactive, volume, novel, space, large",Variant View: Visualizing Sequence Variants in their Gene Context,2,1,3,10,9,5,6,7,4,8,60
"TITLE: DiffAni: Visualizing Dynamic Graphs with a Hybrid of Difference Maps and Animation WORDS: users, use, design, visualizations, interactive, space, large, different, study, technique",DiffAni: Visualizing Dynamic Graphs with a Hybrid of Difference Maps and Animation,6,2,1,5,7,3,9,4,10,8,61
"TITLE: Visualizing Change over Time Using Dynamic Hierarchies: TreeVersity2 and the StemView WORDS: users, use, design, visualizations, interactive, volume, new, different, study, technique",Visualizing Change over Time Using Dynamic Hierarchies: TreeVersity2 and the StemView,6,8,10,2,7,3,4,9,5,1,62
"TITLE: Visual Compression of Workflow Visualizations with Automated Detection of Macro Motifs WORDS: users, use, design, visualizations, interactive, different, study, technique, time, method",Visual Compression of Workflow Visualizations with Automated Detection of Macro Motifs,4,3,8,6,10,1,5,2,7,9,63
"TITLE: Automatic Layout of Structured Hierarchical Reports WORDS: used, users, use, design, visualizations, interactive, space, large, flow, tasks",Automatic Layout of Structured Hierarchical Reports,7,4,3,10,9,8,5,6,2,1,64
"TITLE: Edge Compression Techniques for Visualization of Dense Directed Graphs WORDS: users, use, design, visualizations, interactive, used, different, study, technique, time",Edge Compression Techniques for Visualization of Dense Directed Graphs,7,2,10,5,1,4,9,6,3,8,65
"TITLE: GPLOM: The Generalized Plot Matrix for Visualizing Multidimensional Multivariate Data WORDS: new, novel, users, use, design, visualizations, interactive, space, large, used",GPLOM: The Generalized Plot Matrix for Visualizing Multidimensional Multivariate Data,2,3,9,1,8,7,5,10,4,6,66
"TITLE: Orthographic Star Coordinates WORDS: users, use, design, visualizations, interactive, new, different, study, technique, time",Orthographic Star Coordinates,1,3,5,7,9,2,4,6,8,10,67
"TITLE: Dimension Projection Matrix/Tree: Interactive Subspace Visual Exploration and Analysis of High Dimensional Data WORDS: new, space, large, users, use, design, visualizations, interactive, volume, novel",Dimension Projection Matrix/Tree: Interactive Subspace Visual Exploration and Analysis of High Dimensional Data,5,3,4,9,2,6,10,8,7,1,68
"TITLE: Empirical Guidance on Scatterplot and Dimension Reduction Technique Choices WORDS: users, use, design, visualizations, interactive, new, used, different, study, technique",Empirical Guidance on Scatterplot and Dimension Reduction Technique Choices,1,7,9,4,6,2,5,8,3,10,69
"TITLE: Visualization of Shape Motions in Shape Space WORDS: users, use, design, visualizations, interactive, new, used, different, study, technique",Visualization of Shape Motions in Shape Space,3,6,2,4,5,8,10,1,9,7,70
"TITLE: Fast Blending Scheme for Molecular Surface Representation WORDS: new, used, volume, flow, tasks, novel, space, large, users, use",Fast Blending Scheme for Molecular Surface Representation,2,4,8,3,10,1,5,6,7,9,71
"TITLE: Detecting Symmetry in Scalar fields Using Augmented Extremum Graphs WORDS: users, use, design, visualizations, interactive, new, space, large, flow, tasks",Detecting Symmetry in Scalar fields Using Augmented Extremum Graphs,3,8,5,6,4,1,9,10,7,2,72
"TITLE: Fast Generation of Virtual X-ray Images for Reconstruction of 3D Anatomy WORDS: new, users, use, design, visualizations, interactive, novel, space, large, used",Fast Generation of Virtual X-ray Images for Reconstruction of 3D Anatomy,8,10,3,6,2,1,9,4,7,5,73
"TITLE: An Information-Aware Framework for Exploring Multivariate Data Sets WORDS: new, novel, users, use, design, visualizations, interactive, space, large, flow",An Information-Aware Framework for Exploring Multivariate Data Sets,2,1,6,5,10,9,7,3,4,8,74
"TITLE: Efficient Local Statistical Analysis via Integral Histograms with Discrete Wavelet Transform WORDS: users, use, design, visualizations, interactive, volume, different, study, technique, time",Efficient Local Statistical Analysis via Integral Histograms with Discrete Wavelet Transform,6,1,8,4,3,10,7,2,9,5,75
"TITLE: Characterizing and Visualizing Predictive Uncertainty in Numerical Ensembles Through Bayesian Model Averaging WORDS: new, users, use, design, visualizations, interactive, flow, tasks, space, large",Characterizing and Visualizing Predictive Uncertainty in Numerical Ensembles Through Bayesian Model Averaging,3,1,4,7,10,8,5,6,2,9,76
"TITLE: Contour Boxplots: A Method for Characterizing Uncertainty in Feature Sets from Simulation Ensembles WORDS: users, use, design, visualizations, interactive, volume, different, study, technique, time",Contour Boxplots: A Method for Characterizing Uncertainty in Feature Sets from Simulation Ensembles,3,1,7,8,5,10,9,6,2,4,77
"TITLE: Uncertainty Quantification in Linear Interpolation for Isosurface Extraction WORDS: used, new, space, large, users, use, design, visualizations, interactive, volume",Uncertainty Quantification in Linear Interpolation for Isosurface Extraction,4,2,10,9,8,5,7,6,1,3,78
"TITLE: Coupled Ensemble Flow Line Advection and Analysis WORDS: users, use, design, visualizations, interactive, used, space, large, different, study",Coupled Ensemble Flow Line Advection and Analysis,4,3,8,9,7,5,2,10,6,1,79
"TITLE: Comparative Visual Analysis of Lagrangian Transport in CFD Ensembles WORDS: new, flow, tasks, users, use, design, visualizations, interactive, novel, used",Comparative Visual Analysis of Lagrangian Transport in CFD Ensembles,1,6,9,7,2,3,5,4,8,10,80
"TITLE: Adaptive Refinement of the Flow Map Using Sparse Samples WORDS: users, use, design, visualizations, interactive, used, space, large, different, study",Adaptive Refinement of the Flow Map Using Sparse Samples,1,2,8,6,7,9,3,4,10,5,81
"TITLE: Visualization of Morse Connection Graphs for Topologically Rich 2D Vector fields WORDS: new, users, use, design, visualizations, interactive, novel, used, flow, tasks",Visualization of Morse Connection Graphs for Topologically Rich 2D Vector fields,1,7,9,4,8,3,6,2,5,10,82
"TITLE: Semi-Automatic Vortex Extraction in 4D PC-MRI Cardiac Blood Flow Data using Line Predicates WORDS: new, space, large, users, use, design, visualizations, interactive, used, novel",Semi-Automatic Vortex Extraction in 4D PC-MRI Cardiac Blood Flow Data using Line Predicates,4,8,5,3,9,1,2,7,10,6,83
"TITLE: Design by Dragging: An Interface for Creative Forward and Inverse Design with Simulation Ensembles WORDS: users, use, design, visualizations, interactive, flow, tasks, new, volume, used",Design by Dragging: An Interface for Creative Forward and Inverse Design with Simulation Ensembles,9,1,10,5,2,6,3,8,4,7,84
"TITLE: A Multi-Criteria Approach to Camera Motion Design for Volume Data Animation WORDS: new, users, use, design, visualizations, interactive, novel, space, large, used",A Multi-Criteria Approach to Camera Motion Design for Volume Data Animation,2,1,9,5,10,8,6,7,3,4,85
"TITLE: A Lightweight Tangible 3D Interface for Interactive Visualization of Thin fiber Structures WORDS: space, large, used, users, use, design, visualizations, interactive, new, volume",A Lightweight Tangible 3D Interface for Interactive Visualization of Thin fiber Structures,3,2,10,6,8,4,7,1,5,9,86
"TITLE: Evaluation of Static and Dynamic Visualization Training Approaches for Users with Different Spatial Abilities WORDS: users, use, design, visualizations, interactive, new, space, large, used, different",Evaluation of Static and Dynamic Visualization Training Approaches for Users with Different Spatial Abilities,7,2,4,9,3,10,5,6,8,1,87
"TITLE: A Systematic Review on the Practice of Evaluating Visualization WORDS: users, use, design, visualizations, interactive, different, study, technique, time, method",A Systematic Review on the Practice of Evaluating Visualization,10,6,1,3,4,8,5,7,9,2,88
"TITLE: Interactive Patient-Specific Vascular Modeling with Sweep Surfaces WORDS: users, use, design, visualizations, interactive, new, flow, tasks, different, study",Interactive Patient-Specific Vascular Modeling with Sweep Surfaces,1,4,3,7,5,9,10,2,6,8,89
"TITLE: Area-Preservation Mapping using Optimal Mass Transport WORDS: space, large, new, volume, flow, tasks, users, use, design, visualizations",Area-Preservation Mapping using Optimal Mass Transport,4,9,3,5,2,1,8,7,6,10,90
"TITLE: Colon Flattening Using Heat Diffusion Riemannian Metric WORDS: new, used, novel, volume, users, use, design, visualizations, interactive, flow",Colon Flattening Using Heat Diffusion Riemannian Metric,3,8,6,1,2,5,10,7,4,9,91
"TITLE: Vessel Visualization using Curved Surface Reformation WORDS: users, use, design, visualizations, interactive, new, volume, flow, tasks, different",Vessel Visualization using Curved Surface Reformation,5,4,7,1,8,10,6,3,2,9,92
"TITLE: ConnectomeExplorer: Query-Guided Visual Analysis of Large Volumetric Neuroscience Data WORDS: users, use, design, visualizations, interactive, new, different, study, technique, time",ConnectomeExplorer: Query-Guided Visual Analysis of Large Volumetric Neuroscience Data,2,9,10,5,7,1,8,3,4,6,93
"TITLE: ManyVis: Multiple Applications in an Integrated Visualization Environment WORDS: used, new, space, large, volume, novel, flow, tasks, users, use",ManyVis: Multiple Applications in an Integrated Visualization Environment,8,6,3,7,5,2,9,1,10,4,94
"TITLE: Acuity-Driven Gigapixel Visualization WORDS: users, use, design, visualizations, interactive, different, study, technique, time, method",Acuity-Driven Gigapixel Visualization,1,3,8,5,9,4,6,7,10,2,95
"TITLE: An Exploration Framework to Identify and Track Movement of Cloud Systems WORDS: new, space, large, used, users, use, design, visualizations, interactive, novel",An Exploration Framework to Identify and Track Movement of Cloud Systems,7,6,1,4,5,2,3,8,10,9,96
